question,answer
What was Bob Bradley's previous job before he took the job as the head coach of the United States men's national soccer team?,Head coach of Chivas USA
What is the actor's name from the TV series The Big Bang Theory who also starred in the movie School for Scoundrels?,Jim Parsons
Who is the director of the first part The Curse of the Black Pearl  in the flim Pirates of the Caribbean?,Gore Verbinski
What is the name of the football player who won the player of the season title in 2021 for Barnsley F.C?,Michał Helik
In which year did the American sitcom series Will & Grace return for another three seasons after ending in 2006?,2017
What year did the American sitcom series Will & Grace return for three more seasons after the original run ended?,2017
Which player was awarded the most number of Man of the match titles in the FIFA world cup of 2006?,Andrea Pirlo
How many movies were in the Die Hard series before A Good Day to Die Hard came out in 2013?,4
How many John le Carré novels featured the character George Smiley after The Spy Who Came in from the Cold?,6
How many appearance did the American goalkeeper Sean Johnson make with the US men's national soccer team in 2011?,1
"When was the original version of the song ""I am not a woman, I’m a god"" released in USA?","August 31, 2021"
According to the 11 Nov 2021 result who called the most capped player in Brazil Nation Football Team ?,Cafu
"What is the name of the ghostwriter of the first book in the Hardy Boys series, The Tower Treasure?",Leslie McFarlane
What is the total number of appearances made by Marco Reus as of 2021 for the club Borussia Dortmund?,332
"Before A Good Day to Die Hard's release in 2013, how many movies were in the Die Hard series?",4
What is the name of the book that comes after the book Killing Floor in the Jack Reacher series?,Die Trying
"What year was it on Earth in the last novel of The Chronicles of Narnia series, The Last Battle?",1949
How many goals did Pat Healey make in the 2008 season when he was playing for Crystal Palace Baltimore?,8
Who is the character that Robin ends up marrying in the last season of How I Met Your Mother?,Barney Stinson
"What is the name of the first episode of the first season of the series, Buffy the Vampire Slayer?",Welcome to the Hellmouth
Which 2009 first person shooter game did Lance Henriksen who was Frank Black in Millennium did voice work for?,Call of Duty: Modern Warfare 2
What were the demographics of black people in Memphis Tennessee when If Beale Street Could Talk was written?,38.9%
What is the name of the 2012 movie that fetched Meryl Streep an Oscar for the best actress?,The Iron Lady
"When was released the song ""I'm Your Angel"" in United States in the format of Contemporary hit radio?",13 October 1998
What is the name of the actress who won the Academy Award in 2014 instead of Sandra Bullock?,Cate Blanchett
Director of the first part The Curse of the Black Pearl  in the flim Pirates of the Caribbean?,Gore Verbinski
The American goalkeeper Sean Johnson played how many game for the US men's national soccer team in 2011?,1
"Who is the screenwriter  of the second part ""Dead Man's Chest"" in the flim Pirates of the Caribbean?",Terry Rossio
"When was the song ""Easy on Me"" released in United States in the format of Adult contemporary radio?",18 October 2021
Did Olympique Lyonnais retained their league title when Megan Rapinoe was on their roster from 2013 to 2014?,Yes
"Who was the head coach for CF Montréal soccer team from August 10, 2011 to November 3, 2012?",Jesse Marsch
What is the FIFA organization that was founded in Mexico City and currently includes all of North America?,CONCACAF
What is the name of the model who won the first cycle of America's Next Top Model?,Adrianne Curry
What is the name of the movie released in 2004 did the singer Chris Martin appear in?,Shaun of the Dead
What is the name of the football club that Oliver Kahn played for in the year 2001?,FC Bayern Munich
"Who is the screen writer of The Chronicles of Narnia: The Lion, the Witch and the Wardrobe?",Christopher Markus
Who was the winner of the Nobel Prize in Literature the year Brave New World was published?,John Galsworthy
Which player scored the most goals for the D.C. United during the 1996 Major League Soccer season?,Raúl Díaz Arce
What is the name of the film directed and written by John Hughes in the year 1984?,Sixteen Candles
What was the first movie that Mila Kunis who played Jackie on That '70s Show act in?,Santa with Muscles
What book set in Jazz Age considered to be a Great American Novel was written in 1925?,The Great Gatsby
What was the first show to win the Outstanding Multi-Camera Picture Editing for a Comedy Series award?,The Adams Chronicles
What was the name of the actor who played Charlie in Willy Wonka and the Chocolate Factory?,Peter Ostrum
"What is the last album that was recorded by artist George Harrison, from the band the Beatles?",Brainwashed
How many World Cup titles the Italy national football team has before winning it again in 2006?,3
What number of appearances has Andrea Pirlo made for the football club New York City FC?,62
What year did the El Salvador national football team make their first FIFA World Cup appearance?,1970
"When was released the song ""Shape of You"" in United Kingdom in the digital download format?",10 February 2017
What was the other book to get the Newbery Honor in 2019 besides The Night Diary?,The Book of Boy
"When was released the song ""Into You"" in United States in the format of rhythmic contemporary?","June 28, 2016"
What has the home venue of the Kansas City Wizards been from 2011 to the present?,Children's Mercy Park
"Who is the director of The Chronicles of Narnia: The Lion, the Witch and the Wardrobe?",Andrew Adamson
What is the number of goals scored by Kylian Mbappé for France in the year 2018?,9
What is the award nominated for the tv series wizards of waverly place in year 2008?,Directors Guild of America Award for Outstanding Directing – Children's Programs
Which film by Clint Eastwood has won the maximum number of Academy Awards and BAFTA Awards?,Unforgiven
What is the name of the manager in 2017 of the soccer club Manchester United F.C.?,José Mourinho
Which movie did Samuel L. Jackson win a BAFTA award for best supporting actor in 1994?,Pulp Fiction
"What year was the book ""And to Think That I Saw It on Mulberry Street"" published?",1937
Who managed Norwich City F.C. when they were promoted to the English Premier League in 2021?,Daniel Farke
Which team promoted to the English Premier League for 2021-22 won the EFL Championship in 2021?,Norwich City F.C.
Which soccer player scored the second highest number of goals for the Poland national football team?,Włodzimierz Lubański
Which Clint Eastwood movie has won the most number of Academy Awards and BAFTA  Awards?,Unforgiven
Who was the shirt sponsor of the Chicago Fire Football Club in 2019 to present?,Motorola
Who was the captain of Manchester United F.C. when they won the 1999 FA cup?,Roy Keane
What is the film which won Cate Blanchett the Oscar for best actress in 2014?,Blue Jasmine
Which science fiction tv series did Charles Shaughnessy appeared in for one episode in 2004?,Stargate SG-1
Which football club was represented by the soccer player Raúl González in the year 2002?,Real Madrid
What was the name of the football club Mikel Arteta represented in the year 2003?,Rangers F.C.
Which soccer player scored the most number of goals in the UEFA Euro 2004 tournament?,Milan Baroš
In the 1998-1999 NBC Must See TV lineup which show directly preceded Will & Grace?,Friends
Who was the kit manufacturer from 2015 to present for New York City Football club?,Adidas
Who won the most Man of the match awards in the 2006 FIFA World Cup?,Andrea Pirlo
When did The United States Soccer Federation become affiliated and a full member with FIFA?,1914
"What award won the National Board of Review Awards in December 2, 2021 for ""Encanto""?",Best Animated Film
"When the song ""Cold Heart"" released in Italy in the format of Digital download streaming?",13 August 2021
Which movie did Steven Spielberg directed the same year as Catch Me If You Can?,Minority Report
How many goals did Pele scored for Brazil national football team in the year 1971?,1
Who was the top goal player as of 2021 in FIFA Beach Soccer World Cup?,Madjer
Who was the Kit manufacturer from 2012 to present for New England Revolution soccer club?,Adidas
"Who directs season 1 episode ""Welcome to Matheson"" in the tv series locke & key?",Michael Morris
What is the name of the club Wayne Rooney played for in the year 2003?,Everton F.C.
What is the name of the football club Iker Casillas represented in the year 2002?,Real Madrid Castilla
Who won the America's Next Top Model in the season next to Adrianne Curry's cycle?,Yoanna House
What is the  Award recieved in 2008 by the tv series wizards of waverly place?,Directors Guild of America Award for Outstanding Directing – Children's Programs
Which 1925 novel set in the Jazz age is hailed as a Great American Novel?,The Great Gatsby
"What is the name of the first movie in the series, Lord of the Rings?",The Lord of the Rings: The Fellowship of the Ring
What's the name of the 1960 psychological horror film produced and directed by Alfred Hitchcock?,Psycho
What is the name of the chef that won the Master Chef Australia season twelve?,Emelia Jackson
Who was the Manager of St Johnstone F.C. when they won the 2014 Scottish Cup?,Tommy Wright
"What year did the book The Cat in the Hat, by Dr Seuss come out?",1957
Director name of the first season “somebody’s dead” in the tv series Big Little Lies?,Jean-Marc Vallée
What is the Publication date of the Second book of the series His Dark Materials?,22 July 1997
Which book by John le Carré was the last to feature the character George Smiley?,A Legacy of Spies
What is the award received in 1990 for Most Promising Actress by Vanessa Paradis?,César Award
who won the best visual effects award in 2021 satellite award for Tenet movie?,Andrew Jackson
How many goals did Pele scored for New York Cosmos in the year 1975?,17
Which is the first book of the novel series Little House on the Prairie?,Little House in the Big Woods
What was the next feature film Robert Zemeckis directed after Back to the Future?,Who Framed Roger Rabbit
Which 1992 legal drama movie starring Tom Cruise that was written by Aaron Sorkin?,A Few Good Men
What year was the book Angry Blonde written by the rapper Eminem get published?,2000
Who was the first winner of the first season of the TV series Survivor?,Richard Hatch
"How many players in the Columbus Crew Soccer Club as of December 1, 2021?",31
For which 1979 movie did Dustin Hoffman win an Academy Award for Best Actor?,Kramer vs. Kramer
What is the title of the second film in the Star Wars prequel trilogy?,Star Wars: The Last Jedi
Which album by Metallica was released first: Ride the Lightning or Master of Puppets?,Ride the Lightning
How many goals did Pele scored for New York Cosmos in the year 1976?,26
What team did New York FC defeated to win the MLS Cup in 2021?,Portland Timbers
What year was Michael Jackson inducted into the Rock and Roll Hall of Fame?,"1997, 2001"
What is the title of the fourth film in the Star Wars film series?,Star Wars: Episode I – The Phantom Menace
in which award won the best song of MTV Europe music awards in 2021?,Bad Habits
"When was Angels & Demons, the first book in the Robert Landon series, published?",01 May 2000
How many tracks were on side two of The Police's debut album Outlandos d'Amour?,5
In what year did the El Salvador national football team win the CCCF Championship?,1943
Who did Terence Stamp play in Star Wars: Episode I – The Phantom Menace?,Finis Valorum
How many goals did the second place score in the 2020-2021 Premier league season?,22
What is the sports team played in 2012 to 2014 by Alessandro Del Piero?,Sydney FC
Who were the directors of the episode named MADMAX of the series Stranger Things?,Duffer brothers
What is the number of movies in the Home Alone series as of 2021?,6
Which is the second book of the novel series Little House on the Prairie?,Farmer Boy
"In which 1995 action thriller movie did Antonio Banderas play an assassin, Miguel Bain?",Assassins
What's the last movie Viggo Mortensen acted in before The Fellowship of the Ring?,28 Days
What is the number of goals scored by Julio Salinas for Spain in football?,22
What is the first book published in the Loyal League series by Alyssa Cole?,An Extraordinary Union
Which actress won the Academy Awards for the best actress in the year 1952?,Vivien Leigh
Who is the Original Broadcaster of Season 1 of the tv series The Tunnel?,Sky Atlantic
In which year did the player Luís Figo transfer from Barcelona to Real Madrid?,2000
Which is the last novel of the book series Diary of a Wimpy Kid?,Diary of a Wimpy Kid: Big Shot
Which football player was the recipient of 2001 FIFA World Player of the Year?,Luís Figo
How many matches has Franz Beckenbauer played for Germany national football team in 1965?,3
What's the US release date for the second film in the Mad Max series?,24 December 1981
How many matches has Jan Oblak played for Slovenia national football team in 2014?,1
"What is the second movie in the film series, The Lord of the Rings?",The Lord of the Rings: The Two Towers
When was the first time the US women's soccer team received a gold medal?,1996
In which year did the novel The Old Man and the Sea come out?,1990
What is the name of the first part of the book series The Expanse?,Leviathan Wakes
When was the first time the US women's soccer team went to the Olympics?,1996
Which is the year in which the director Stephen Chow his very first movie?,1994
Who directs the first season “somebody’s dead” in the tv series Big Little Lies?,Jean-Marc Vallée
What movie starring Jack Nicholson was the last to be released in the 1990s?,As Good as It Gets
Director of season 1 episode 1 in the tv series locke & key?,Michael Morris
How many Golden Globe Awards did One Flew Over the Cuckoo's Nest get?,6
Who was the Spanish king when part 1 of Don Quixote was published?,Philip III of Spain
Name of the director who directed the first episode of the show Vikings?,Johan Renck
What was New England Revolution's final position after the 2021 regular MLS season?,1st
What is the year the first book of the series Earth's Children published?,1980
Who was the kit manufacturer of Chelsea Football Club from 1981 to 1983?,Le Coq Sportif
What was the name of the third series in Empire of the Moghul?,Ruler of the World
What was Black Eyed Peas' debut album after being signed by Interscope Records?,Behind the Front
In which year was the dystopian science fiction novel Brave New World written?,1931
"Who is Kansas City Wizard's number one goalkeeper as of December 21st, 2021?",John Pulskamp
Who was the captain of the San Jose Earthquakes from 2009 to 2013?,Ramiro Corrales
Who is the author of the The Last Thing he told me book?,Laura Dave
How many goals did Harry Kane score in the 2020-2021 Premier league season?,23
What number of years later was the sequel of The Bourne Identity released?,2
Is the film Shazam! won National Film and Television Awards won or not?,Won
Did Yeon Sang-ho wrote and directed the animated film The King of Pigs?,Yes
Who was the kit sponsor for Atlanta United FC in 2016 to present?,Adidas
"Antonio Banderas played an assassin, Miguel Bain, in which 1995 action thriller film?",Assassins
How many goals did Paul Pogba scored for France national under-18 football team?,1
What's the name of the first book in the Wheel of Time series?,The Eye of the World
What is the fourth track on the album Slipknot by the band Slipknot?,Wait and Bleed
How many matches did Paul Pogba played for France national under-18 football team?,6
"Who played Spock, the Vulcan First Officer, in Star Trek: The Original Series?",Leonard Nimoy
What was the name of the novel Charles Dicken wrote before Oliver Twist?,The Pickwick Papers
Who acted as a spider man in the movie spider man from 2002-2007?,Tobey Maguire
Who is the captain of both French football team and Tottenham Hotspur F.C.?,Hugo Lloris
In what year did Real Madrid CF win their first FIFA World Cup?,2014
How many episodes are there in season 1 of the TV series Lucifer?,13
How many matches did 1. FC Köln win during the first Bundesliga season?,17
who is the director of episode 1 in the tv series Sky Castle?,Jo Hyun Tak
What is the title of the first book in the Jack Reacher series?,Killing Floor
How many International matches played for Portugal national football team by João Félix?,20
At which football club did Argentine footballer Diego Maradona score the most goals?,Argentinos Juniors
Which clubs in the Superclasico won the Primera Division league title in 2021?,River Plate
What year was the first book of the series Francisco de Robles published?,1605
How many titles has Chicago Fire FC won in the US Open Cup?,4
What is LL Cool J's role on the 2009 police procedural tv series?,Sam Hanna
Bethlehem Steel's won how many titles in the Lamar Hunt U.S. Open Cup?,5
What is the total number of goals secured by Marco Reus for Germany?,15
"When the book ""The Color Purple"" won the National Book Award for Fiction?",1983
What is the first movie that Zachary Levi was nominated for an award?,Tangled
Who did Arsenal F.C. defeat in the semi-final of the FA Cup 2000-01?,Tottenham Hotspur F.C.
What is the name of the Croatian national  team captain before Luka Modrić,Darijo Srna
Who was the runner up national team in the 2018 FIFA World Cup?,Croatia national football team
What was the title of the second movie in the Indiana Jones series?,Indiana Jones and the Temple of Doom
When did the last episode of How I Met Your Mother air on?,"March 31, 2014"
Which album features Nate Dogg's Billboard Hot 100 no. 1 hit from 2003?,Get Rich or Die Tryin'
How many teams were there in the 2021-2022 season of the Scottish Cup?,113
Which football player was awarded FIFA world player of the year in 1999?,Rivaldo
What club did Darijo Srna play for the most in his overall career?,FC Shakhtar Donetsk
Who is the director of the first movie of the The Expendables series?,Sylvester Stallone
How many matches Thiago Silva played for played for national team in 2008?,3
Who is the director of the second movie of the The Expendables series?,Simon West
What is the name of the movie directed by Tim Burton in 1990?,Edward Scissorhands
In which year does Alisha Chinai won the award Best Music Video?,1996
"How many episodes in the season 1 of ""Emily in Paris"" series?",10
When was Men at Work inducted into the ARIA Hall of Fame?,1994
Who is the director of the third film in the Bourne series?,Paul Greengrass
How many games Kevin De Bruyne played for Belgium national football team?,88
Which album by Britney Spears was released first Baby One More Time?,Baby One More Time
What date did the pilot episode of Space: Above and Beyond aired?,24 September 1995
who is the sponsor of  Kit manufacturer of 2020  Al-Hilal SFC team?,S Team
"When own the award People's Choice Awards for the movie ""Black Widow""?","December 7, 2021"
What is the total number of goals Roy Keane secured for Ireland?,9
Which P. G. Wodehouse novel was first published in the year 1902?,The Pothunters
How many number of national matches did Cristiano Ronaldo played for Portugal?,Six
"What was the population of Lorain, Ohio when the book was set?","44,125"
How many users are there of the TV network Amazon Prime Video?,175 million
"How many tracks are on Jay-Z's 11th studio album, The blueprint 3?",15
What year was the first book of the series Old Kingdom published?,1995
What year end chart did Mr. Bojangles rank 44th on in 1971?,Billboard Hot 100
What is the name of the Tom Tom Club's first studio album?,Tom Tom Club
What football club was represented by Roy Keane in the year 1990?,Cobh Ramblers F.C.
What is the title of the 93rd episode of the Arrow series?,Legacy
Was Terence Stamp in Star Wars: Episode I – The Phantom Menace?,Yes
How many matches did Eden Hazard played for Belgium national football team?,116
On what date did the first episode of Saturday Night Live air?,"October 11, 1975"
What is the first date when the TV series Coupling got aired?,12 May 2000
What is the number of episodes of the TV series Money Heist?,41
What year did Inter Milan win their first FIFA Club World Cup?,2010
Which football club did Robert Lewandowski play for in the year 2020?,FC Bayern Munich
Who was the manager of the soccer Manchester United F.C. in 2017?,José Mourinho
How many goals did Eden Hazard scored for Belgium national football team?,33
What show did Leslie Jordan have a recurring role on in 2005?,Boston Legal
Which soccer player won the European Golden shoe in the year 2005-2006?,Luca Toni
"Who directs the episode ""Liber"" ""The Book"" in tv series Luna Nera?",Francesca Comencini
Who is the director of the season 1 of the series Hanna?,Sarah Adina Smith
Which is the First Hindi movie as Cinematographer of Mr. Laxman Utekar?,Khanna & Iyer
What was the rank of the song ''deja vu'' published by Pitchfork?,10
What is the name of the last movie in the Bourne series?,Jason Bourne
What is the first novel adaptation movie that Matt Damon acted in?,The Good Mother
How many movies are there in the Home Alone franchise till 2021?,6
Which is the First Hindi movie as director of Mr. Laxman Utekar?,Hindi Medium
Who was the director of the 1984 A Nightmare on Elm Street?,Wes Craven
What club did the soccer player Pelé represent in the year 1976?,New York Cosmos
What film is the third in the series of Mad Max films?,Mad Max Beyond Thunderdome
In 2020 which American country singer received the National Medal of Arts?,Toby Keith
How many titles has Bethlehem Steel won in the US Open Cup?,5
Who scored the most number of goals for the club Borussia Dortmund?,Alfred Preissler
What is the name of the first album of the Jeff Russo?,Lemon Parade
Who named Adele the Artist of the Year twice in the 2010s?,Billboard
Which club did David Beckham transferred from to LA Galaxy in 2007?,Real Madrid CF
What is the award received in 2003 by the American rapper Eminem?,Academy Award for Best Original Song
Which movie got Vivien Liegh the Oscar for best actress in 1952?,A Streetcar Named Desire
Who is the director of episode one of the tv series Ekaterina?,Aleksandr Baranov
Which book comes first in the Loyal League series by Alyssa Cole?,An Extraordinary Union
What is the ranking of Kid A on rolling stone in 2009?,1
How many matches did Bruno Fernandes played for Portugal national football team?,40
What was the first scripted TV show that Alan Ritchson performed on?,Smallville
In which country was the novel The Stand by Stephen King published?,United States of America
What is the name of the last movie directed by Alan Parker?,The Life of David Gale
Which movie of the the Terminator series has the highest worldwide collection?,Terminator 2: Judgment Day
In 2021-2022 season how many teams took part in the Scottish Cup?,113
How many tracks are on Inna's I Am the Club Rocker album?,13
What year did the book A Tale of Two Cities come out?,1859
Which 1960 psychological horror film was produced and directed by Alfred Hitchcock?,Psycho
When did the US women's soccer team first win the world cup?,1991
What is the title of the 1st episode of TV series See?,Godflame
Which national team was the runner up in FIFA World Cup 2018?,Croatia national football team
Who played Charline in the movie Willy Wonka and the Chocolate Factory?,Peter Ostrum
What was the title of the fourth book in the Twilight series?,Breaking Dawn
How many songs were on the album Pieces of You by Jewel?,14
How many goals has Jan Oblak scored for Slovenia national football team?,0
"What was the first TV show Tom Welling appeared on after ""Smallville?""",Lucifer
Which movie of the the Terminator series has the lowest worldwide collection?,The Terminator
Did the first Godfather film win the Academy Award for Best Director?,No
"Which record label released Shakira's second English album, Oral Fixation, Vol. 2?",Epic
Which football player's transfer was the most expensive in association football history?,Neymar
"What's the movie after ""West Side Story"" that Rachel Zegler appeared in?",Shazam! Fury of the Gods
What was the name of the first Beatles album that was recorded?,Please Please Me
what year was the book The Old Man and the Sea pubblished?,1990
Name of the winner of the thirteenth season of Master Chef Australia?,Justin Narayan
The new Hawaii Five-0 wrapped up after how many season's on CBS?,10
Manchester United F.C. last won the FIFA world cup in what year?,2008
What was the 16th and final book in the Left Behind series?,Kingdom Come
What club did Andoni Goikoetxea play for in the year 1980?,Athletic Bilbao
how many total pages of The Mirror and the Light book?,784
Who captains the French soccer team and the club Tottenham Hotspur?,Hugo Lloris
"Who directs the episode ""Glorious Purpose"" in the tv series Loki?",Kate Herron
What was the first movie David Callaham wrote the screenplay for?,Doom
What novel was awarded the Pulitzer Prize for Fiction in 2017?,The Underground Railroad
What is the title of the first Wheel of Time book?,The Eye of the World
What was the title of the first movie directed by him?,The Last House on the Left
Who was the top scorer for the 2020-2021 Premier league season?,Harry Kane
Who was the first person to serve as the team's captain?,Jay DeMerit
How many matches did Thibaut Courtois played for Belgium national team?,94
