question,answer
How many records did Louis Armstrong created?,Twelve
Number of tracks in Vande Mataram album?,9
When was the series Riverdale first aired?,26 January 2017
Which is the fourth album by Fugazi?,Red Medicine
What year did soccer join the olympics?,1900
How many total episodes in Mindhunter  series?,19
Initial album released by Simon & Garfunkel?,"Wednesday Morning, 3 A.M."
Which is the first film as director?,Yahaan
How many seasons was there in Supernatural?,Fifteen
How many season of The Mentalist aired?,Seven
Who won the MLS Cup in 2021?,New York City FC
"Who directed the first four ""Scream"" movies?",Wes Craven
Who sponsored Bayern Munich's kits in 2017?,Adidas
How many matches did Ronaldinho played for?,Twenty two
Which team did Xavi played in 1998?,FC Barcelona B
second film in the Bridget Jones' franchise?,Bridget Jones: The Edge of Reason
What was his first screenplay writing credit?,Anna of Brooklyn
Third movie in the Mad Max series?,Mad Max Beyond Thunderdome
Which team was the first Bundesliga Champion?,1. FC Köln
how many number of Breaking Bad seasons?,5
In which city was William Golding born?,Newquay
Which is the sixth novel of Premchand?,Vardan
What German state has the lowest population?,Bremen
When was the Free Guy movie published?,13 August 2021
Which novel was Stephen Kings first one?,Carrie
Who was Rangers F.C.'s first kit suppliers?,Umbro
Which was Rachel McAdams' first Hollywood movie?,The Hot Chick
The Cranberries released how many albums total?,8
What was the first Indiana Jones Film?,Raiders of the Lost Ark
What was Herb Alpert's first studio album?,The Lonely Bull
Which Lost season has the most episodes?,1st
Which company published Call for the Dead?,Victor Gollancz Ltd
What is Oliver Stone's date of birth?,15 September 1946
Who won the Regionalliga West in 2021?,Borussia Dortmund II
What tribual group contains the most members?,Cherokee
Winner of the 2021 MLS cup?,New York City FC
how many episodes of Riverdale series?,100
Which was Julia Robert's first movie?,Firehouse
What's the last track on Elephunk?,Where Is the Love?
how many seasons of Daredevil  series?,3
What was Dove Cameron's first EP?,Bloodshot / Waste
What was David Lynch's fifth film?,Wild At Heart
Who was Austin FC's first sponsor?,Adidas
how many seasons of Riverdale series?,6
In which city Joseph Heller born?,New York City
the Aerosmith band started in year?,1970
What was Alexandra Stan's first album?,Saxobeats
The year this Aerosmith band began?,1970
What was Sean Maguire first show?,Grange Hill
How many episodes of Lucifer series?,93
which year started this Queen band?,1970
What was Matt Damon's debut movie?,Mystic Pizza
First published book by Stephen King?,Carrie
how many seasons of dark series?,3
What was Alan Alda TV debut?,The Phil Silvers Show
What was Cherami Leigh's debut role?,Shiki
What was Chi McBride tv debut?,The Fresh Prince of Bel-Air
Jewel's first album was called what?,Pieces of You
Lark Voorhies' first television appearance?,"Good Morning, Miss Bliss"
Where was Anne Rice born?,New Orleans
What was Jewel's first album?,Pieces of You
When was Enola Holmes?,23 September 2020
