question,answer
What was the 4th track on All the Stars and Boulevards?,Boston
Which club did David Beckham play for in the year 2000?,Manchester United F.C.
What was the last series title of Empire of the Moghul?,Traitors in the Shadows
What movie by Steven Soderbergh was released in the year 2001?,Ocean's Eleven
How many goals have Lionel Messi scored for Paris Saint-Germain F.C.?,1
Which is the debut studio album of the band Pearl Jam?,Ten (Pearl Jam album)
How many of the Ryanverse books were written by Tom Clancy?,17
How much is the budget of 2001: A Space Odyssey movie?,$10.5 million
How many Academy Awards was won by the film The Matrix?,Four
"How many people are living in Exeter, New Hampshire in 2020?",16049
Which team won the first edition of Copa America in 1916?,Uruguay national football team
What movie was directed by Shane black in the year 2005?,Kiss Kiss Bang Bang
Which artist created the most memorable song on the Juice soundtrack?,Naughty by Nature
Which is the second last novel of the book series Millennium?,The Girl Who Takes an Eye for an Eye
Who scored the most goals on the Portland Thorns in 2018?,Lindsey Horan
Which was the first award won by the movie The Matrix?,Academy Awards
Total number of goals scored by Franz Beckenbauer for Bayern Munich?,75
What TV series did the Duffer Brothers write for in 2015?,Wayward Pines
How many group points did Uruguay have after winning the Maracanazo?,5
For which club did Gareth Bale played in sports team 2006?,Southampton F.C.
What was the first film that he created the music for?,Rumble Fish
How many matches have Lionel Messi played for Paris Saint-Germain F.C.?,10
What is highest number of view for a episode in Friends?,31.3 Million
How many years after The Bourne Identity was its sequel released?,2
What was the publication year of the first Perry Mason book?,1933
Which team won the first MLS Cup in Major League Soccer?,D.C. United
"What was the rating for season 1 of the series""The Wire""?",79
What year did the 4th season of Crank Yankers originally air?,2007
What club did Gabriel Batistuta play for in the year 1999?,ACF Fiorentina
How many matches has João Félix played for Portugal in 2019?,5
What was the first MCU tv series that aired on Netflix?,Daredevil
Name the soccer club Kevin De Bruyne played for in 2018?,Manchester City F.C.
Which club did John Terry play for in the year 2018?,Aston Villa F.C.
Who was the FC Cincinnati soccer club captain from 2019to 2020?,Kendall Waston
Who won the first season of the US version of Survivor?,Richard Hatch
How many goals has João Félix scored for Portugal in 2020?,3
What is the award received by singer Laura Pausini in 2006?,Grammy Award for Best Latin Pop or Urban Album
Which club did Johan Cruyff play for in the year 1976?,FC Barcelona
What team did Brazil beat in the 2020 Olympic soccer finals?,Spain
In 2007 David Beckham transferred from which club to LA Galaxy?,Real Madrid CF
What club did Philipp Lahm play for in the year 2010?,FC Bayern Munich
Which clubs were promoted to the English Premier League in 2021?,Brentford F.C.;Norwich City F.C.;Watford F.C.
What was the award received in 2014 by the movie Leviathan?,Asia Pacific Screen Award for Best Feature Film
What is the first part name of the tv series medici?,"Medici: Masters of Florence, season 1"
"What is the first song on Blink 182's album, Cheshire Cat?",Carousel
Which is the second movie as director of Ashwiny Iyer Tiwari?,Nil Battey Sannata
How many seasons did the new Hawaii Five-0 run on TV?,10
What year was the last film directed by Alan Parker released?,2003
Which soccer club won the U.S. Open Cup title in 2019?,Atlanta United FC
Which song on Songs About Jane has the shortest run time?,Harder to Breathe
Who was the FIFA world player of the year in 1999?,Rivaldo
Number of goals by Michal Helik for Poland national football team?,0
Who was the winning goalkeeper in the 2001 FA Cup Final?,Sander Westerveld
What is the name of the final episode of The Expanse?,Babylon's Ashes
What show was Dalila Bella in before Anne with an E?,Ready Jet Go!
"In 2019, which author received the Hugo Award for Best Novel?",Mary Robinette Kowal
What was the second tv series that John Lithgrow worked on?,Great Performances
What work won the Hugo Award for Best Novelette in 2014?,The Lady Astronaut of Mars
How many matches did Xavi played for the club FC Barcelona?,505
Who was the kit manufacturer for Norwich City F.C. in 2021?,Joma
How many goals did Messi score in international play from 2005-2021?,80
Who won the Grammy Lifetime Achievement Award for the year 1963?,Bing Crosby
Which is the first movie as director of Ashwiny Iyer Tiwari?,What's For Breakfast?
Which sports team did Diego Maradona played in 1982 - 1984?,FC Barcelona
How many stories are collected in Stephen King's novel Skeleton Crew?,22
In what year was the band The Cranberries first album released?,1993
Which sports team did Nuno Gomes played in 2002 to 2011?,S.L. Benfica
Who is the captain of the club FC Barcelona in 2022?,Sergio Busquets
How many albums did the band The Cranberries release in total?,8
Who was the publisher of the The Sun Also Rises book?,Charles Scribner's Sons
What is the number of seasons of the TV series Mom?,8
Who is the captain of Brazilian football team in 2021?,Thiago Silva
Which is the Debut movie as director of Ashutosh Gowariker?,Pehla Nasha
Which is the first film as writer of Leena Gangopadhyay?,Bhalo Theko
Which is the last album of the singer Britney Spears?,Glory
Which is the debut movie as actress of Stephenie Meyer?,Twilight
What was the first show that Ross Hull was in?,Nowhere to Hide (1987 film)
What was the name of the first show he hosted?,Total Panic
What was the most sold album from the band Slipknot?,Slipknot
How many goals did Mesut Özil scored for Arsenal F.C.?,44
Which is the first movie in The Hobbit film series?,The Hobbit: An Unexpected Journey
What number of episodes did the TV series Coupling have?,4
In what film did Donald Sutherland make his acting debut?,The World Ten Times Over
Which is the first album of the singer Jagjit Singh?,Arth
Which team won the 2020 season of UEFA European Championship?,Italy
Who was the winner of best film editing that year?,Michael Kahn
Release year of the first book of Old Kingdom series?,1995
How many goals did Virgil van Dijk scored for Netherland?,5
Which is the second album of the singer Britney Spears?,Oops!... I Did It Again
When did George Lucas receive his first Academy Award nomination?,1973
Which is the second movie in The Hobbit film series?,The Hobbit: The Desolation of Smaug
What role did Hugh Laurie play in Jeeves and Wooster?,Bertie Wooster
Who directed the first episode of the television series Shooter?,Simon Cellan Jones
What year did Mork & Mindy go on the air?,1978
Which is the first short movie directed by Hardik Mehta?,Chal Meri Luna
In 2021 which league did the Nagoya Grampus compete in?,J1 League
In what year did soccer become part of the olympics?,1900
Release year of first book of Earth's Children book series?,1980
What is the name of the first James Bond Film?,Dr. No
How many goals did Franz Beckenbauer score for Bayern Munich?,75
Which is the first movie as writer of Kunal Deshmukh?,Jannat
What is the Daily mean temperature of Kabul in jan?,−2.3
In which movie did Kathleen Turner make her acting debut?,Body Heat
Which is the debut novel of the novel series Millennium?,The Girl with the Dragon Tattoo
Which is the first book of the writer khushwant singh?,The Mark of Vishnu and Other Stories
What was the name of Stephen King's first published book?,Carrie
How many books were given the Newbery Honor in 2019?,2
Which is the second album of the singer Lucky Ali?,Sifar
Which film did Stephen King first credited as a screenwriter?,Creepshow
how many pages of The Sound and the Fury book?,326
How many matches did Thibaut Courtois appeared for Chelsea F.C.?,126
What club did Luca Toni represent in the year 2015?,Hellas Verona F.C.
What is the title of the last James Bond movie?,No Time to Die
Who won the European Golden Boot for the year 2005-2006?,Luca Toni
In how many matches has Dele Alli played for England?,4
How many total matches did Pele played for Santos FC?,660
What was Dove Cameron's first single as a featured artist?,Taste of You
which date releasing the Netherlands country Save Your Tears song?,"August 9, 2020"
Who was the first editor for the newspaper The Times?,John Walter
How many teams participated in the inaugural UEFA European Championship?,4
which date released Someone You Loved song in united states?,16 April 2019
What record come out in 2005 from the band Augustana?,All the Stars and Boulevards
Which is the Debut movie as producer of Ashutosh Gowariker?,Swades
Which movie is the second in the Bridget Jones' series?,Bridget Jones: The Edge of Reason
Which is the first novel of the book series Millennium?,The Girl with the Dragon Tattoo
How many International matches did Lionel Messi played for Argentina?,Twenty
In which club did played in 2010 by harry kane?,Tottenham Hotspur F.C.
What award did The Rachael Ray Show win in 2008?,Daytime Emmy Award for Outstanding Talk Show Entertainment
How many episodes are in season 1 of The Flash?,23
What was Dr. Seuss's last published book before he died?,"Oh, the Places You'll Go!"
Which is the first movie directed by Amit V. Masurkar?,Sulemani Keeda
who is the Sleeve Sponsor of Borussia Dortmund in 2022?,Opel
What is the budget of 2001: A Space Odyssey movie?,$10.5 million
which club did Gareth Bale played in sports team 2008?,Tottenham Hotspur F.C.
How many matches has Roque Júnior played for A.C. Milan?,44
In what film did Elizabeth Inglis make her acting debut?,Borrowed Clothes
Which is the first movie as director of Kunal Deshmukh?,Jannat
"12 Years as a Slave, when did it come out?",8 November 2013
Who comes before the Germany national team in FIFA rankings?,United States National Football Team
When Friends first aired who was the president of NBC?,Pat Weaver
Which soccer club did Fabio Cannavaro play for in 2007?,Parma Calcio 1913
To what football club did Oliver Kahn belong in 2001?,FC Bayern Munich
Who won the Oscars for the best actress in 1952?,Vivien Leigh
Which is the Debut movie as Cinematographer of Ericson Core?,Exit in Red
Which is the debut movie of the actress Richa Chadha?,Oye Lucky! Lucky Oye!
Which club did Cafu play for in the year 2005?,A.C. Milan
which date releasing the song See You Again world wide?,"April 3, 2015"
How many books are in The Chronicles of Narnia series?,7
What year did The Hardy Boys book series first debut?,1927
Which is the Debut movie as director of Ericson Core?,Invincible
In which movie did David Twohy make his directorial debut?,Timescape
Which That '70s Show season had the highest viewer number?,3rd
When did the 2nd season of The Newsroom first air?,"July 14, 2013"
How many matches has Fábio Coentrão played for Portugal U20?,7
Who won the 2001 FIFA World Player of the Year?,Luís Figo
Which is the first movie as director of Jay Roach?,Zoo Radio
Which is the first movie directed by director Anubhav Sinha?,Tum Bin
Which is debut film of Aanand L. Rai as Director?,Strangers
Which club did Gabriel Batistuta play for after ACF Fiorentina?,A.S. Roma
What was Shirley MacLaine's next film after The Evening Star?,Mrs. Winterbourne
Which award received in 2003 by the movie The Ring?,MTV Movie Award for Best Villain
What year was Inna's Hot album released in the US?,2009
What club did Neymar play for in the year 2015?,FC Barcelona
Which is the First movie as director of Ruchi Narain?,Kal: Yesterday and Tomorrow
Who won promotions to the English Premier League for 2021-22?,Brentford F.C.;Norwich City F.C.;Watford F.C.
"What was the first Emmy Award won by ""The Conners?""",Outstanding Multi-Camera Picture Editing for a Comedy Series
What was the last album released by the Indian Ocean?,Tandanu
What is the first work of Michael Barrett as cinematographer?,Finding North
What movie released in 2010 was directed by Ridley Scott?,Robin Hood
Did Steven Knight wrote 1st episode of TV series See?,Yes
Who won the Hugo Award for Best Novel in 2019?,Mary Robinette Kowal
Which is the first movie directed by director Stephen Chow?,From Beijing with Love
Which team won the final of the FA Cup 2000-01?,Liverpool F.C.
What was the frist television show Tom Kapinos wrote for?,Dawson's Creek
Against which opponent Bruno Fernandes scored his last international goal?,Luxembourg
Which is the second movie of the The Expendables series?,The Expendables 2
Where was the final played for the 2000-01 FA Cup?,Millennium Stadium
Which club did Rivaldo play for in the year 1999?,FC Barcelona
What Billboard Music Award was won by Tool in 2020?,Billboard Music Award for Top Rock Album
Which CONCACAF countries participated in the 1930 FIFA World Cup?,Mexico national football team;United States men's national soccer team
What movie did Quentin Tarantino direct in the year 2009?,Inglourious Basterds
name of the club Jan Oblak played for in 2012?,S.L. Benfica
Who played the character with the most appearances in M*A*S*H?,Alan Alda
How many appearances has Jan Oblak made for his nation?,44
Which stadium hosted the final of the 2000-01 FA Cup?,Millennium Stadium
Which is the first movie as director of Nitesh Tiwari?,Chillar Party
Who became the head coach of A.C. Milan in 2019?,Stefano Pioli
What is the second book of Alfred A. Knopf Inc?,Beloved
Which club did Cristiano Ronaldo represent in the year 2011?,Real Madrid CF
Which is the second movie of the The Terminator series?,Terminator 2: Judgment Day
Who was the winner of Master Chef Australia Season 13?,Justin Narayan
which date was Emily in Paris season 1 released?,"October 2, 2020"
Which movie was directed by Rohit Shetty in 2013?,Chennai Express
How many goals Diego Maradona scored for Boca Juniors?,30
Andrea Pirlo joined the club Juventus in which year?,2011
For which team did Franz Beckenbauer participated in 1964?,FC Bayern Munich
Which MLS team won the MLS Cup in 2021?,New York City FC
Which is the first novel of R. K. Narayan?,Swami and Friends
What was the name of Alexandra Stan's debut album?,Saxobeats
Which is the second novel of the series Discworld?,The Light Fantastic
How many tracks are there in the album LSD?,10
When was the Australian country song Dance Monkey released?,10 May 2019
"Where the song ""Love Me Like You Do""released first?","Canada,United Stated"
who was the author for Pride and Prejudice book?,Jane Austen
Pulp Fiction movie was written and directed by whom?,Quentin Tarantino
Which is the first movie created by Stephen Sommers?,Perfect Alibi
What was the first TV show he acted in?,Tales of the Gold Monkey
Who directed the episode MADMAX of Stranger Things series?,Duffer brothers
What album did the band Augustana release in 2005?,All the Stars and Boulevards
When did the anime series first aired in Japan?,18 April 1998
Lin-Manuel Miranda won his second Tony for this musical?,Hamilton
Which book won the 2017 Pulitzer Prize for Fiction?,The Underground Railroad
What was John Williams debut feature film as composer?,Daddy-O
Which 1Star Trek: Voyager episode was their first one?,"Caretaker, Part I"
Which is the first album of the band Euphoria?,Dhoom
What was the number of songs on that album?,14
Luis Suárez made his Liverpool debut against which club?,Stoke City F.C.
Which is the first movie produced by Anand Pandit?,Great Grand Masti
How many goals has Dele Alli scored for England?,3
how many total episodes of True Detective series ?,24
Who was the first author selected for this award?,Jerry Pournelle
Which is the Debut movie of Anaita Shroff Adajania?,Dilwale Dulhania Le Jayenge
How many goals did Nicolò Barella score for Italy?,7
How many international game di Neymar play for Brazil?,12
what is the language of Crime and Punishment book?,Russian
Which is the first movie directed by Rohit Shetty?,Zameen
When was Taste of You featuring Dove Cameron released?,2021
How many times did Franz Beckenbauer appear for Germany?,103
Which is the first hindi short story of Premchand?,Lekhak
Which is the longest track of the LSD album?,Genius
How many episodes did Neil Grayston appear in Psych?,1
What was the first single from the Graduation album?,"Can't Tell Me Nothing"""
What year was the novel Brave New world written?,1931
Which is the last novel of the series Redwall?,The Rogue Crew
In which year did Mork & Mindy first air?,1978
Which year was the first Perry Mason novel published?,1933
Which is the First novel of the series Redwall?,Lord Brocktree
Which is the second movie directed by Indra Kumar?,Beta
releasing date of season 1 of Emily in Paris?,"October 2, 2020"
What is the name of Dove Cameron's first EP?,Bloodshot / Waste
Which movie was directed by Hardik Mehta in 2015?,Amdavad Ma Famous
When did the series finale of Frasier first aired?,13 May 2004
Release year of the first Francisco de Robles book?,1605
What year did A.C. Milan started wearing Adidas shirts?,1990
When did Sergio Busquets take part in Sergio Busquets?,"2010 FIFA World Cup,  2014 FIFA World Cup, UEFA Euro 2012"
What 1991 movie did Barry Levinson produce and direct?,Bugsy
Which is the latest movie written by Zak Penn?,Free Guy
For which team did Daniel Passarella played in 1986?,Inter Milan
How many matches Carlos Kaiser played for Fluminense FC??,1
When was the first series of Black Mirror released?,4 December 2011
What is the debut work of the Michael Waldron?,Community
How many goals has Fábio Coentrão scored for Portugal?,5
In Which year pele starts playing brazil national team?,1957
Which soccer club did Ronaldinho play for in 2009?,A.C. Milan
Which is the second book of the series Divergent?,Insurgent
What was the last album recorded by the Beatles?,Let it Be
When did A.C. Milan win their first league title?,1901
who is the producer of When I'm Gone song?,Eminem
In which film Benedict Wong got his debut role?,Kiss Kiss (Bang Bang)
What movie was directed by Chloé Zhao in 2017?,The Rider
The Chronciles of Narnia series contains how many novels?,7
Who was Chicago Fire FC's head coach in 2012?,Frank Klopas
What was the title of US Survivor's second season?,Survivor: The Australian Outback
who is the publisher Klara and the Sun book?,Alfred A. Knopf
Who was the last emperor of the Russian Empire?,Nicholas II of Russia
How many books are there in the Twilight Series?,5
What was Jack Nicholson's last film of the 1990s?,As Good as It Gets
How many episodes are in first season of Mom?,22
Which Saturn Award did The 100 receive in 2015?,Saturn Award for Best Youth-Oriented Television Series
Which sports team did Robert Lewandowski played in 2010-2014?,Borussia Dortmund
What is the title of Bryan Adams' first album?,Bryan Adams
What was the first movie Sean Marshall was in?,The Deadly Trackers
How many songs are on Do You Wanna Ride?,13
Which year did the first X-Men movie come out?,2000
How many people were part of the band Graduate?,5
Which player is the most expensive association football transfer?,Neymar
How many goals did Sergio Busquets score for Spain?,2
How many matches have Neymar played for Paris Saint-Germain?,80
What is the second book in the Twilight series?,New Moon
What number of novels does the Twilight Series have?,5
In which year was the first X-Men movie released?,2000
How many goals did Bruno Fernandes scored for Portugal?,6
What is the name of Adina Howard's debut album?,Do You Wanna Ride?
Who was the first person to receive this award?,Edward Ardizzone
Number of episodes in third season of Third Watch?,22
How many goals Bruno Fernandes scored for Sporting CP?,39
Which is the first movie produced by Nitesh Tiwari?,Break Point
Which sports team did Diego Maradona played in 1976-1980?,Argentinos Juniors
How many seasons were there in Game of Thrones?,8
What was the band Blink 182's first album called?,Cheshire Cat
Which is the first album of the band Aerosmith?,Aerosmith (album)
What country did Messi score his first goal against?,Croatia national football team
Which sports team did Robert Lewandowski played in 2008-2010?,Lech Poznań
What movie did Alan Parker direct after Midnight Express?,Fame
What television program did George Grizzard first act on?,The Twilight Zone
What's the title of the first Indiana Jones movie?,Raiders of the Lost Ark
In what year was The Cranberries final album released?,2019
What club did Lionel Messi play for in 2021?,Paris Saint-Germain F.C.
Which team played in 2009 by Landon Donovan?,LA Galaxy
Season 1 director name of the series Hanna?,Sarah Adina Smith
How many episodes are there in first season?,13
What show did Lark Voorhies first appear on?,"Good Morning, Miss Bliss"
how many pages of Brave New World book?,311
Was Matthew Morrison in American Horror Story: 1984?,Yes
Which is the first novel of Munshi Premchand?,Devasthan Rahasya
Which year was Megadeth's fifteenth album Dystopia released?,2016
Which is the next novel of R.K. Narayan?,Swami and Friends
Which team played in 2008 by Thomas Müller?,FC Bayern Munich II
Which team did Franz Beckenbauer played in 1964?,FC Bayern Munich
What club did Eden Hazard play for first?,Lille Olympique Sporting Club
Which club played in 2007-2008 by Aleksandr Kerzhakov?,Sevilla FC
What was the second film by David Lynch?,The Elephant Man
What 2002 movie starred Mary-Kate and Ashley Olsen?,When in Rome
What was the first movie she performed in?,Night and the City
Which Steven Soderbergh movie was released in 2001?,Ocean's Eleven
What company sponsored Bayern Munich's shirts in 2017?,Deutsche Telekom
Which team did Luka Modrić played in 2012?,Real Madrid CF
How many Academy Awards did John Barry received?,5
Who sponsored Manchester United F.C.  kit in 2021?,Adidas
What team won the MLS cup in 2021?,New York City FC
Which club played in 2009-2010 in Aleksandr Kerzhakov?,FC Dinamo Moscow
Which is the debut movie of Kevin Alejandro?,Purgatory Flats
Which is the latest book of Robin Sharma?,The Everyday Hero Manifesto
When was Jurassic park The lost world  released?,23 May 1997
How many Grammy awards did John Prine win?,5
Blade Runner Movie was released in which year?,1982
Which awards are won by Sour in 2021?,People's Choice Awards;Apple Music Awards
Who was Serie A league champion in 2021?,Inter Milan
Which is the first novel of Chetan Bhagat?,Five Point Someone
What was Simon & Garfunkel's first studio alubm?,"Wednesday Morning, 3 A.M."
Which is the first book of Robin Sharma?,Megaliving!: 30 Days to a Perfect Life
Which club did Andrea Pirlo join after Juventus?,New York City FC
What is the last book of Discworld series?,The Shepherd's Crown
"How many seasons of the series ""True Detective""?",3
How many people were in the band Nirvana?,3
What club did John Terry represent in 2018?,Aston Villa F.C.
Which club played in 1986-1992 by Marcel Desailly?,F.C. Nantes
How many episodes are in the first season?,25
Which 1987 movie was directed by George Miller?,The Witches of Eastwick
Which is the first book of Paulo Coelho?,Teatro da Educação
What novel did John Steinbeck write in 1937?,Of Mice and Men
Which is the debut film of Prathamesh Parab?,Balak-Palak
Which club played in 2011 by Luis Suárez?,Liverpool F.C.
What movie did Joel Schumacher direct in 1987?,The Lost Boys
Which team did Daniel Passarella represented in  1986?,Inter Milan
Michael Ballack played for which club in 2004?,FC Bayern Munich
How many Academy Awards did Gosford Park win?,1
Who won the first season of The Apprentice?,Bill Rancic
Who decided when Seven Film will be released?,15 September 1995
Who is the Sense and Sensibility executive producer?,Sydney Pollack
In which city was George Orwell was born?,Motihari
Which club did Robert Lewandowski played in 2009?,Lech Poznań
First air of second season of The Newsroom?,"July 14, 2013"
Which club played in 2003 by Andrés Iniesta?,FC Barcelona
How many goals has Bebe scored till date?,44
Which team did Christian Pulisic played in 2016?,Borussia Dortmund
Which 1986 movie did Christopher Guest act in?,Little Shop of Horrors
Which club did Andrey Arshavin played in 2009-2013?,Arsenal F.C.
Which year did The Simpsons first season air?,1989
Which club won the Regionalliga West in 2020?,SV Rödinghausen
What year did The Simpsons first season air?,1989
What was the debut single for the Eurythmics?,Never Gonna Cry Again
Which is the first book of Chetan Bhagat?,Five Point Someone
Which club did Nuno Gomes played in 1994?,Boavista F.C.
What was Garry Marshall's first movie acting role?,The Phony American
Whis club did  Kylian Mbappé played in 2015-16?,AS Monaco FC
What is Mary Shelley's most recently published novel?,Mathilda
Third Watch how many episodes in third season?,22
Was Mike Judge part of Beavis and Butthead?,Yes
Which club played from 1985-2019 by Paolo Maldini?,A.C. Milan
What was Keanu Reeves first feature length movie?,Youngblood
What year did David Beckham join Manchester United?,1992
What is Russell Crowe's date of birth?,7 April 1964
In which city John Jakes was Born?,Chicago
the band Queen started in which year?,1970
How many seasons of the peaky blinders,6
Who won the first UEFA European Championship?,Soviet Union
Who earned the most goals in 2017?,David Villa
Which club was J1 League's first champion?,Tokyo Verdy
when was the song Dance Monkey released?,10 May 2019
How many tracks in Vande Mataram album?,9
What is Selena Gomez's most significant work?,"Barney & Friends, Another Cinderella Story"
How many episodes The Umbrella Academy series?,20
