question,answer
What were the British royal houses and how did each of them take the throne?,"['House of Stuart', 'Bill of Rights 1689']"
which novels and novellas did Hemingway write while in Cuba?,"['The Old Man and the Sea', 'Islands in the Stream', 'For Whom the Bell Tolls', 'Across the River and into the Trees']"
Who were the Persian allies during the War of 602-628?,"['Avars (and Slavic allies)', 'Sasanian Iberia', 'Jewish and Samaritan rebels', 'Lakhmids']"
Which are the four European countries with the highest percentage of Green Party representatives in the EU parliament?,"['Germany', 'Finland', 'Lithuania', 'Luxembourg']"
Which European countries are currently governed by a left leaning political party and are also a monarchy?,"['Spain', 'Norway', 'United Kingdom', 'Denmark']"
What are the four most populous landlocked countries in Europe?,"['Kazakhstan', 'Czechia', 'Azerbaijan', 'Hungary']"
What are the four most populous cities in Sierra Leone?,"['Freetown', 'Bo', 'Kenema', 'Koidu']"
"When looking at the world's 40 largest companies in terms of revenues, and specifically, at those companies' nationalities, which of the 10 largest economies in the world are not represented?","['India', 'Italy', 'Canada', 'Brazil']"
Which of the former WNBA finals MVPs currently work as a basketall coach and for what team?,"['Katie Smith', 'Minnesota Lynx']"
what are the four largest sources of renewable energy in Italy?,"['Solar Power', 'Hydro Power', 'Wind Power', 'Bio Energy']"
"What is the largest cat species found on each continent, and its weight in kg?","['Jaguar', 'North America', '56–96 kg']"
"Of Iceland, New Zealand, Holland, and England, put in chronologic order which had a female leader first.","['Holland', 'England', 'Iceland', 'New Zealand']"
"Name the sun deities of the Ancient Egyptian, Greek, Aztec and Norse pantheons.","['Aten', 'Horus', 'Montu', 'Osiris', 'Hathor', 'Ra']"
List all directors that directed a film based on a book by Bret Easton Ellis.,"['Marek Kanievska', 'Roger Avary', 'Mary Harron', 'Gregor Jordan']"
Which songs have Drake and Rihanna collaborated on?,"['Take Care', 'Too Good', ""What's My Name?"", 'Work']"
which four Canadian Prime Ministers have had the highest approval rating in the last 50 years?,"['Jean Chrétien', 'Justin Trudeau', 'Stephen Harper', 'Brian Mulroney']"
"What is the average age of each of the ten most popular personalities (people) on Instagram, Twitter, TikTok and Youtube?",[36.4]
What 20th century wars that Mongolia participated in had them allying with a neighboring country?,"['Battles of Khalkhin Gol', 'Soviet–Japanese War (World War II)', 'Battle of Baitag Bogd', 'Russian Civil War — Eastern Front of the Russian Civil War']"
Name the five US metropolitan areas with the highest share of people against gay marriage.,"['Buffalo–Niagara Falls, New York', 'Spokane, Washington', 'Raleigh–Durham–Chapel Hill, North Carolina', 'Fresno, California', 'Grand Rapids–Muskegon–Holland, Michigan']"
Who did the Prime Minister of Canada run against in the last election?,"[""Erin O'Toole"", 'Yves-François Blanchet', 'Jagmeet Singh', 'Annamie Paul', 'Maxime Bernier']"
"Following the first woman being appointed to the US federal government, which administrations have had zero women in cabinet?","['Warren G. Harding', 'Calvin Coolidge', 'Herbert Hoover', 'John F. Kennedy', 'Lyndon B. Johnson']"
"What happened to the leaders of the two factions at the end of the English Civil War named ""The Anarchy""?","['Stephen of Blois', ""Retained royal powers, recognised Henry FitzEmpress as his adopted son and successor, and gained access to Henry's castles""]"
What are Quentin Tarantino's five highest grossing films in descending order?,"['Django Unchained', 'Once Upon a Time in Hollywood', 'Inglourious Basterds', 'Pulp Fiction', 'Kill Bill: Volume 1']"
Which particular events sparked each one of the different Arab Israeli wars?,"['United Nations General Assembly vote for the Partition Plan for Palestine on 29 November 1947', 'the adoption of the United Nations Partition Plan for Palestine on 29 November 1947', 'Nationalization of the Suez Canal, closing the canal to Israeli shipping and closing the Straits of Tiran to Israeli shipping', 'Egypt closing the Straits of Tiran to Israeli shipping on 22 May 1967', 'Israel declining a peace proposal to withdrawal from the Sinai Peninsula']"
Which out of the most common Jamaican names for boys are of biblical origin?,"['Malachi', 'Nathaniel', 'Joshua', 'Josiah', 'Nathan']"
Which NBA teams play their home games in West Coast states?,"['Portland Trail Blazers', 'Golden State Warriors', 'Los Angeles Clippers', 'Los Angeles Lakers', 'Sacramento Kings']"
Which characters has Scarlett Johansson portrayed in film that were based on either comic books or manga?,['Rebecca Doppelmeyer']
What are the top five countries in descending order with the most electric vehicles in current usage?,"['China', 'United States', 'Germany', 'United Kingdom', 'Norway']"
"Which characters were killed off in The Master and Margarita, and what was the manner of their death?","['Margarita', ""a bottle of Pontius Pilate's (poisoned) wine""]"
which factions had tried to capture the city during each of the Battles of Narbonne and were they successful?,"['Kingdom of Francia', 'no']"
Which kingdoms did the Normans conquer during the middle ages?,"['Italy', 'England', 'Wales', 'Anglo-Norman conquest of Cyprus', 'Canary Islands']"
"Of all NBA players who won finals MVP, list only those with career averages lower than the median in both points assists and rebounds.","['Andre Iguodala', 'Cedric Maxwell', 'James Worthy', 'Kawhi Leonard', 'Paul Pierce']"
Which of the biggest tech companies have at least 20% women on their board?,"['Apple', 'Alphabet', 'Meta', 'Intel', 'IBM']"
What are the occupations of the current spouses of the last five UK prime ministers?,"['businesswoman', 'Accountant', 'Media advisor', 'investment manager', 'Businesswoman']"
What are the five fastest growing economies in the EU?,"['Ireland', 'Malta', 'Greece', 'Cyprus', 'Spain']"
What are the five countries in South America with the lowest GDP?,"['French Guiana', 'Suriname', 'Paraguay', 'Bolivia', 'Guyana']"
Which Toni Morrison novels take place outside of Ohio?,"['Song of Solomon', 'Tar Baby', 'Jazz', 'Paradise', 'A Mercy']"
What have been the changes in European men's formal garb from the high middle ages to that of the Renaissance?,"['14th century', 'breeches made of linen and a shirt also made of linen as undergarments. Hose or chausses made out of wool were used to cover the legs, and often had leather soles, so that they did not have to be worn with shoes. A doublet was a buttoned jacket that was generally of hip length. A robe, tunic, or kirtle was usually worn over the shirt or doublet, over this, a man might also wear an over-kirtle, cloak, or a hood. the chaperon made a transformation from being a utilitarian hood with a small cape to becoming a complicated and fashionable hat worn by the wealthy in town settings.']"
What is the number of female heads of state per continent?,"['Africa', 2]"
Which five European regions saw the sharpest decrease in unemployment from 2007 to 2017?,"['Western Europe', 'Central Europe', 'North-western Europe', 'North-eastern Europe', 'South-western Europe']"
Which five countries have the most nuclear plants?,"['United States', 'France', 'Japan', 'China', 'Russia']"
Which single from Lali Esposito's 2020 album peaked at the Argentina Hot 100?,"['Laligera', 'Como Asi', 'Lo Que Tengo Yo', 'Fascinada', 'Ladron']"
which American edtech companies had their annual revenue exceeding 10M and more than a million users?,"['Coursera', 'Lumosity', 'Udacity', 'Instructure', 'Udemy']"
"Besides the Bucs, what other NFL teams are based in Florida and its neighboring states?",['Miami Dolphins']
Which languages have the highest number of countries where they are the official language? List the top 5.,"['English', 'French', 'Arabic', 'Spanish', 'Portuguese']"
To what Asian countries does Japan export goods in a value which exceeds $25 billion?,"['Taiwan', 'Hong Kong', 'ASEAN', 'China', 'South Korea']"
Name the CNN top brass and their titles.,"['John Stankey', 'CEO of AT&T Inc.']"
In which spider-man story arcs were Gwen Stacey and Mary Jane Watson both featured?,"['Spider-Verse', 'Go Down Swinging', 'The Original Clone Saga', 'Green Goblin Reborn!', 'Clone Saga']"
"Since 2015, who are the five youngest head coaches in the NFL, in ascending order, along with their age?","['Jonathan Gannon', '40']"
Which founders of the Big Five tech companies would be considered millennials?,"['Mark Zuckerberg', 'Eduardo Saverin', 'Andrew McCollum', 'Dustin Moskovitz', 'Chris Hughes']"
What are the top 5 most common professions amongst parents of Oscar winners for best actress following 2003?,"['homemaker', 'Actor', 'Founder and CEO of a general-contracting company', 'nurse', 'Homeopathic chiropractor']"
Which teams in England's premier league have more than 50% of their players born in England?,"['Newcastle United', 'Everton', 'Bournemouth', 'Sheffield United', 'Luton Town']"
Which battles have lead to the fall of each Shogun dynasty?,"['Oda shogunate', 'Battle of Sekigahara']"
"Tell me the country, city and chef of the restaurants that got the 3 Michelin stars in 2015.","['France', 'Les Belleville', 'René and Maxime Meilleur']"
Which Thai salads can be considered vegetarian friendly?,"['Som tam khai khem', 'Tam maphrao on sen mi krop', 'Yam bai cha', 'Yam hua pli thot', 'Yam khai dao']"
Which rulers were allied with emperor Charles V of Austria during his reign?,"['Charles I', 'Henry VIII', 'John I', 'Ludovik II', 'John III', 'Ferdinand I']"
What's the percentage of female Nobel prize laureates for each prize category?,"['Physiology or Medicine', 5.240174672489083]"
"Tell me the average expenditure on healthcare, education and housing during the Gordon Brown government compared to those of David Cameron's","['Healthcare Gordon Brown', 114000000000.0]"
Which Female costars of Tom Hanks have won Oscars for Best Actress during the 1900s?,"['Susan Sarandon', 'Emma Thompson', 'Sally Field', 'Meryl Streep', 'Joanne Woodward', 'Helen Hunt']"
What popular Turkish surnames are named after animals?,"['Şahin', 'Doğan', 'Aslan', 'Koç', 'Kurt', 'Erdoğan']"
Which actors won both best supporting actor and best actor Oscar awards?,"['Denzel Washington', 'Gene Hackman', 'Jack Lemmon', 'Jack Nicholson', 'Kevin Spacey', 'Robert De Niro']"
"In House of the Dragon, which main characters were portrayed by several different actor?","['Princess / Queen Rhaenyra Targaryen', 'Queen / Dowager Queen Alicent Hightower', 'Prince Jacaerys Jace Velaryon', 'Prince / King Aegon II Targaryen', 'Lady Baela Targaryen', 'Lady Rhaena Targaryen']"
"What were the heads of the Babylonian, Greek, Norse, Mayan, Japanese and Egyptian pantheons the gods of?","['Marduk', 'Creation', 'water', 'agriculture', 'justice', 'medicine', 'magic']"
Which children of the Mamas and the Papas members had also pursued a career in singing?,"['Mackenzie Phillips', 'Chynna Phillips', 'Bijou Phillips', 'Owen Vanessa Elliot', 'John Doherty', 'Mattia Borrani']"
which Latin American countries currently have a conservative head of state?,"['Saint Barthélemy (France)', 'Ecuador', 'Guatemala', 'Paraguay', 'Costa Rica', 'Uruguay']"
"On HBO's Game of Thrones, name all of the characters that received a dire wolf.","['Jon Snow', 'Robb Stark', 'Sansa Stark', 'Arya Stark', 'Bran Stark', 'Rickon Stark']"
Which works influenced Bulgakov's The Master and Margarita?,"['Faust', 'Dr FaustusLa damnation de Faust', 'Symphonie Fantastique', 'The Brothers Karamazov', 'Anna Karenina', 'El diablo cojuelo']"
"In what years, since 2000, has the same football team won both the Spanish and Champions league?","['2014', '2006', '2009', '2011', '2015', '2022']"
"Did any of the main characters on TV's Black Sails, appear in the book Treasure Island? If so, please list their names.","['Long John Silver', 'Billy Bones', 'Israel Hands', 'Ben Gunn', 'Tom Morgan', 'Tom']"
"Who were the god of death and god of war in ancient Rome, Norway and Mesopotamia?",['Dispater (Pluto)']
Which imperial dynasties ruled for more than 80 years over the Byzantine empire?,"['Justinian dynasty', 'Heraclian dynasty', 'Isaurian dynasty', 'Macedonian dynasty', 'Komnenid dynasty', 'Palaiologan dynasty']"
In what order would the actresses who portrayed Ms. Moneypenny in James Bond movies be if they were arranged youngest to oldest based on their age at their first appearance in the role?,"['Barbara Bouchet', 'Caroline Bliss', 'Samantha Bond', 'Lois Maxwell', 'Naomie Harris', 'Pamela Salem']"
Which companies did each of the Traitorous-Eight go on to co-found following Fairchild Semiconductor?,"['Intel Corporation', 'Fairchild Semiconductor', 'Intel (formerly NM Electronics)', 'Amelco', 'Union Carbide Electronics', 'Intersil']"
"Which medieval English kings that reigned during the 12th century, had at least one of their parents born in France?","['William II', 'Henry I', 'Stephen of Blois', 'Henry II', 'Richard I', 'John Lackland']"
Which kingdoms had defeated the Ottoman empire in the second half of the 15th century?,"['Kingdom of Hungary', 'Kingdom of Naples', 'Kingdom of Sicily', 'Hungary', 'Transylvania', 'Crown of Aragon']"
"Besides the Spanish Flu, what other diseases reached a pandemic like state in the 1900s?","['Spanish flu', 'HIV/AIDS pandemic', '1918–1922 Russia typhus epidemic', '1957–1958 influenza pandemic', 'Hong Kong flu', 'Third plague pandemic']"
Who had been the most bitter enemy of the Kingdom of Ayutthaya throughout its history?,"['Toungoo dynasty (Burma)', 'Toungoo Empire', 'Sukhothai Kingdom', 'Lan Na Kingdom', 'Toungoo dynasty', 'Konbaung dynasty (Burma)']"
Which South American countries with above average homicide rates bordered states where such rates were lower than the international average?,"['Brazil', 'Chile', 'Paraguay', 'Uruguay', 'Colombia', 'Ecuador']"
Which of the metallic dragons Dungeons & Dragons do not breath fire?,"['Copper dragon', 'Silver dragon', 'Adamantine dragon', 'Mercury dragon', 'Mithral dragon', 'Orium dragon']"
What academic degrees do the current governors in Australia hold?,['Bachelor of Laws']
Which films did Martin Scorsese make with Leonardo DiCaprio?,"['Gangs of New York', 'The Aviator', 'The Departed', 'Shutter Island', 'The Wolf of Wall Street', 'Killers of the Flower Moon']"
Which of the UEFA all time scorers married a model?,"['Lionel Messi', 'Thierry Henry', 'Andriy Shevchenko', 'Edin Džeko', 'Mario Gómez', 'Luís Figo']"
Which Amazon Prime original series that has a current season for 2022 is/are based on novels?,"['Island', 'Reacher', 'The Boys', 'The Lord of the Rings: The Rings of Power', 'The Summer I Turned Pretty', 'The Terminal List']"
What members of Israel's 2020 government were either criminally charged or convicted?,"['Aryeh Deri', 'Benjamin Netanyahu', 'Israel Katz', 'Tzachi Hanegbi', 'Yaakov Litzman', 'Yuli Edelstein']"
Which rap artist or group has won the highest number of Grammy awards for best record and best album combined?,"['Childish Gambino', 'Anderson .Paak', 'Lizzo', 'Lauryn Hill', 'Outkast', 'Jon Batiste']"
"What is the largest wild bird found in every continent, save Antarctica?","['Asia', 'Southern cassowary']"
Which Iranian Shanasha dynasties are commonly considered to be of Kurdish ancestry?,"['Safavid dynasty', 'Zand dynasty', 'Rawadid dynasty', 'The Shaddadids', 'The Hasanwayhids', 'The Annazids']"
Which notable alumni from NYU's law school have become human rights activists?,"['Sally Kohn', 'Jamila Wideman', 'Amal Clooney', 'Crystal Eastman', 'Abraham Foxman', 'Thomas Buergenthal']"
What is the percentage of Celtic language speakers in their native countries? List the percentage of speakers out of the total population.,"['Welsh', 17.200178362608]"
Did any wars in Prussia during the 18th and 19th centuries last more than five years?,"['Spanish War of Succession', 'Great Northern War', 'Austrian War of Succession', ""Seven Years' War"", 'Third Silesian War', 'Revolutionary and Napoleonic Wars']"
Which Western African countries have been under military rule over the past 15 years?,"['Burkina Faso', 'The Gambia', 'Guinea', 'Mali', 'Mauritania', 'Niger']"
What are the capital cities of all the New England States?,"['Hartford', 'Augusta', 'Boston', 'Concord', 'Providence', 'Montpelier']"
"Besides hydroelectricity, what are other green energy sources?","['wind power', 'solar power', 'hydrogen', 'uranium', 'natural gas', 'synthetic fuels']"
To what Asian countries does Japan exports goods in a value which exceeds $25 billion?,"['China', 'Taiwan', 'South Korea', 'Thailand', 'Hong Kong', 'United Arab Emirates']"
Name the consorts of current European monarchs that were not born to noble families?,"['Charlene Wittstock', 'Letizia Ortiz Rocasolano', 'Silvia Sommerlath', 'María Teresa Mestre y Batista', 'Máxima Zorreguieta Cerruti', 'Sonja Haraldsen']"
What titles did the fathers of Henry VIII wives hold?,"['King of Aragon', 'King of Castile']"
What other books did the main antagonist of The Dark Tower appear in?,"['The Stand', 'The Eyes of the Dragon', 'Hearts in Atlantis', ""Gwendy's Button Box"", ""Gwendy's Magic Feather"", ""Gwendy's Final Task""]"
"Besides clay, what are some other surfaces that tennis can be played on?","['Grass', 'concrete', 'asphalt topped with acrylic', 'carpet', 'hardwood flooring', 'Artificial turf']"
Which dishes typically include the world's most expensive spice?,"['khoresh', 'risotto', 'paella', 'bouillabaisse', 'biryani', 'Golden Ham']"
"Were any of the kings of France ever involved in a war against England (or the UK) as well as in a separate war against Spain during their reign? If so, please tell me which ones.","['Francis I the Father of Letters', 'Henry II', 'Henry III', 'Louis XIII the Just', 'Louis XIV the Great the Sun King', 'Louis XV the Beloved', 'Napoleon I']"
What television shows produced by Renaissance Pictures were filmed in New Zealand?,"['Hercules: The Legendary Journeys', 'Xena: Warrior Princess', 'Young Hercules', 'Jack of All Trades', 'Cleopatra 2525', 'Legend of the Seeker', 'Ash vs Evil Dead']"
"Besides London, what is the most common birthplace of British prime ministers over the past 30 years?","['St Helier, Surrey', 'Edinburgh, Scotland', 'Giffnock, Scotland', 'Marylebone, London, United Kingdom', 'Eastbourne, England', 'New York City, US', 'Oxford, England']"
Name the academy award winning directors who were less than 35 years old when first winning the award?,"['Lewis Milestone', 'Norman Taurog', 'Fred Zinnemann', 'Francis Ford Coppola', 'Oliver Stone', 'Sam Mendes', 'Damien Chazelle']"
which players have won both a scoring title and an MVP since Michael Jordan retired?,"['Kobe Bryant', 'LeBron James', 'Kevin Durant', 'Russell Westbrook', 'Stephen Curry', 'James Harden', 'Joel Embiid']"
What were the deficit and tax revenues during each year of president Trump?,"['2017', '$503 billion (requested)', '$3.316 trillion']"
"Which kingdoms, outside of Scandinavia, were founded by Vikings?","['the kingdom of the Isles (Suðreyjar)', 'Orkney (Norðreyjar)', 'York (Jórvík)', 'the Danelaw (Danalǫg)', 'Dublin (Dyflin)', 'Normandy', ""Kievan Rus' (Garðaríki)""]"
Who is the main female protagonist in each of George Eliot's novels?,"['Hetty Sorrel', 'Maggie Tulliver', 'Eppie', 'Romola', 'Esther Lyon', 'Dorothea Brooke', 'Gwendolen Harleth']"
Name the Luxembourg prime ministers who ruled the country for more than 10 years .,"['Félix, Baron de Blochausen', 'Paul Eyschen', 'Joseph Bech', 'Pierre Dupong', 'Pierre Werner', 'Jacques Santer', 'Jean-Claude Juncker']"
Which NBA centers under 6'10 have won the MVP award?,"['Bill Russell', 'Bob McAdoo', 'Bob Pettit', 'Dave Cowens', 'Moses Malone', 'Wes Unseld', 'Willis Reed']"
which Baroque paintings by Dutch and Flemish artists are found at the Hermitage?,"['Self-Portrait by Anthony van Dyck (1622–1623)', 'Portrait of Inigo Jones', 'Portrait of William Laud', 'Madonna with Partridges']"
What labours out of Hercules's twelve did not require him to kill a mythical beast?,"['Capturing the Ceryneian Hind', 'Capturing the Erymanthian Boar', 'Cleaning the Augean stables in a single day', 'Capturing the Cretan Bull', 'Stealing the Mares of Diomedes', 'Obtaining the girdle of Hippolyta, queen of the Amazon', 'Stealing three of the golden apples of the Hesperides']"
When and to where has Cheesecake Factory expanded internationally?,"['UAE', '2012']"
"Which Peruvian Presidents were either killed or comitted suicide, and how old were they when they died?","['Agustín Gamarra', '56']"
What was the job of the main protagonist in each of the notable African American sitcoms of the 70s and 80s?,"['entrepreneur', 'George Jefferson', 'The Jeffersons']"
Who are the seven Archons in Gnostic belief and what is the origin of each of their names?,"['Yaldabaoth', 'Aramaic word meaning chaos']"
What was the average percentage of women Nobel prize laureates in Literature in each decade since 1950?,"['1960s', 9.090909090909093]"
What were the incidents that sparked each one of the Napoleonic wars?,"['the Peninsular War', 'French and Spanish armies invaded and occupied Portugal in 1807 by transiting through Spain.']"
What languages are spoken in Scandinavia?,"['Danish', 'German']"
Which Fast and Furious big bads went on to star in multiple films in the series?,"['Arturo Braga', 'Deckard Shaw', 'Dominic Toretto', 'Herman Reyes', 'Owen Shaw', 'Cipher', 'Jakob']"
What were the origins of the foreign pharaonic dynasties that ruled over Egypt?,"['Dynasty XV (Hyksos), Avaris', 'Hyksos, Canaanite']"
Who has killed each of the seven homunculi in Fullmetal Alchemist Brotherhood?,"['Pride', 'Edward']"
Which leading works by Chaucer included themes of a religious nature?,"['Translation of Roman de la Rose', 'The Book of the Duchess', 'The House of Fame', 'Parlement of Foules', 'The Canterbury Tales', ""Translation of Boethius' Consolation of Philosophy"", 'The Legend of Good Women']"
Which terrorist organizations had carried out each of the ten most deadly attacks on European soil since 1980?,"['Russian government (disputed)', 'FSB (disputed)', 'GRU (disputed)', 'Achemez Gochiyayev and accomplices (disputed)']"
"Name the seven most populous cities in Italy, their number of residents and when were they founded.","['Palermo', '676,118', '734 BC']"
Which countries out of Poland and its neighbors were ever invaded by the Mongols?,"['Poland', 'Lithuania', 'Russia', 'Ukraine', 'Czech Republic', 'Belarus', 'Slovakia']"
What are the worlds top 8 largest big cats by weight?,"['Tiger', '142 kg']"
"Which Roman and Egyptian gods were the equivalent of Ares, Hephaestus, Hecate and Enyo?",['Mars']
Who are the NBA MVP players that have never won a championship?,"['Allen Iverson', 'Charles Barkley', 'Derrick Rose', 'James Harden', 'Joel Embiid', 'Karl Malone', 'Russell Westbrook', 'Steve Nash']"
Which Languages are spoken by more than 3.5% of the world population?,"['English', 'Mandarin Chinese', 'Hindi', 'Spanish', 'French', 'Modern Standard Arabic', 'Bengali', 'Indonesian']"
How many civilian deaths did each Balkan country suffer during World War 2? List country name and number of casualties.,"['European Turkey', '200']"
Which NBA scoring champions held the title for at least 3 consecutive years?,"['Bob McAdoo', 'George Gervin', 'George Mikan', 'James Harden', 'Kevin Durant', 'Michael Jordan', 'Neil Johnston', 'Wilt Chamberlain']"
Which mythical creatures appear in Ibsen's Peer Gynt?,"['A pastor/The Devil (Peer Gynt thinks he is a pastor)', 'A green-clad woman, a troll princess', 'The Old Man of the Mountains, a troll king (Also known as The Mountain King)', 'Multiple troll-courtiers, troll-maidens and troll-urchins', 'Brownies, nixies, gnomes, et al.', 'The Bøyg, a voice in the darkness', 'The Sphinx at Giza', 'A button-moulder']"
"Besides the Raiders, what other NFL mascot is in a human form?","['Sourdough Sam', 'Pat Patriot', 'Steely McBeam', 'Raider Rusher', 'Rowdy', 'Viktor the Viking', 'Captain Fear', 'Sir Saint']"
What are the birth countries of players in roster of the Denver Nuggests?,"['U.S.', 'Slovenia', 'United States', 'Serbia', 'Canada', 'US', 'Beverley Hills, California, U.S', 'Australia']"
who is on the board of directors at Tesla?,"['Robyn Denholm', 'Elon Musk', 'Kimbal Musk', 'Ira Ehrenpreis', 'James Murdoch', 'Kathleen Wilson-Thompson', 'Joe Gebbia', 'J. B. Straubel']"
"What Israeli cities with more than 100,000 people currently have a mayor that's affiliated with the country's coalition?","['Jerusalem', 'Petah Tikva', 'Ramat Gan', 'Bat Yam', 'Netanya', 'Holon', 'Ashdod', 'Beit Shemesh']"
What are the titles of Thai nobility?,"['Chaophraya', 'Phraya', 'Phra', 'Luang', 'Khun', 'Muen', 'Phan', 'Nai']"
What is the ethnicity of the main protagonists in each GTA game?,"['Grand Theft Auto: Chinatown Wars', 'Chinese-American']"
What were the eight tallest towers of the architect that designed the tallest building in the year 2000?,"['Burj Khalifa', 'Sears Tower (renamed Willis Tower), Wacker Drive, Chicago, USA', 'Willis Tower', 'Sears Tower, renamed Willis Tower, Chicago, 1970–1973', 'One World Trade Center', 'Jin Mao Tower', 'Nanjing Greenland Financial Center', 'Al Hamra Tower']"
List the number of Marvel Comics female superhero debuts by decade.,"['1940s', 4]"
What is number of Nobel prize winner alumni of each Ivy league school?,"['Columbia University', 46]"
Which point guards did Charles Barkley play alongside with during his time in Phoenix?,"['Frank Johnson', 'Kevin Johnson', 'Cooper, Duane', 'Johnson, Frank', 'Johnson, Kevin', 'Perry, Elliot', 'Ruffin, Trevor', 'Rencher, Terrence']"
Name the eight most populous cities in Italy along with their number of residents and population density.,"['Rome', '4,342,212', '2,236/km2']"
