question,answer
what are the most common names for girls in the UK that are not originally Biblical?,"['Amelia', 'Aoife', 'Rosie', 'Olivia', 'Isla', 'Ava', 'Ivy', 'Florence', 'Lily', 'Freya', 'Mia', 'Willow', 'Emily', 'Fiadh', 'Millie', 'Sophie', 'Ella', 'Charlotte']"
In which states did Joe Biden win by more than 10 % margin than Donald Trump during the presidential elections in 2020 ?,"['California', 'Colorado', 'Connecticut', 'Delaware', 'Washington, D.C.', 'Hawaii', 'Illinois', 'ME-1', 'Maryland', 'Massachusetts', 'New Jersey', 'New Mexico', 'New York', 'Oregon', 'Rhode Island', 'Vermont', 'Virginia', 'Washington']"
"In the novel David Copperfield, who are the non-working class characters?","['Clara Copperfield', 'Clara Peggotty', 'Betsey Trotwood', 'Dr Edward Chillip', 'Edward Murdstone', ""Emily (Little Em'ly)"", 'Mr Creakle', 'James Steerforth', 'Emma Micawber', 'Mr Wickfield', 'Agnes Wickfield', 'Uriah Heep', 'Mrs Heep', 'Julia Mills', 'Mrs Emma Steerforth', 'Francis Spenlow', 'Dora Spenlow', 'Sophy Crewler', 'Mr Jorkins']"
"In the first two novels of Franz Kafka, who are the female characters in each, and how is each of them related to the protagonist?","['Frieda', 'Sexual relationship']"
What celeberities that had a cameo appearance on the TV show Dave were not singers?,"['Rachel McAdams', 'Charlamagne tha God', 'Angela Yee', 'Ninja', 'Kourtney Kardashian', 'Marshmello', 'Hailey Bieber', 'Kendall Jenner', 'Kyle Kuzma', 'Kareem Abdul-Jabbar', 'Zach King', 'DJ Drama', 'Kevin Hart', 'Don Cheadle', 'Megan Fox', 'Travis Barker', 'Emma Chamberlain', 'David Dobrik', 'Brad Pitt']"
What non-Arabic languages are considered official in countries where Arabic is an official language?,"['Berber', 'Comorian', 'French', 'Kurdish', 'None', 'Somali', 'English', 'Bambara', 'Bobo', 'Bozo', 'Dogon, Toro So', 'Fula', 'Kassonke', 'Maninke', 'Minyanka', 'Senufo, Senara', 'Songhay, Koyraboro Senni', 'Soninke', 'Tamasheq']"
"Who have been the rulers of Libya, since its independence?","['Idris I', 'Muammar Gaddafi', 'Abdul Ati al-Obeidi', 'Muhammad az-Zaruq Rajab', 'Mifta al-Usta Umar', 'Abdul Razzaq as-Sawsa', 'Muhammad az-Zanati', ""Miftah Muhammed K'eba"", 'Imbarek Shamekh', 'Mohamed Abu al-Qasim al-Zwai', 'Mustafa Abdul Jalil', 'Mohammed Ali Salim', 'Mohammed Magariaf', 'Giuma Ahmed Atigha', 'Nouri Abusahmain', 'Abu Bakr Baira', 'Aguila Saleh Issa', 'Fayez al-Sarraj', 'Mohamed al-Menfi']"
"In the kingdom of France, what were the royal houses and how did they come to replace the previous royal house?","['House of Bourbon (1589–1792)', 'Margaret of Valois, the last legitimate Valois descendant, named her son with Henry of House Bourbon, as her heir']"
For each Latin American country list its percentage of Amerindians sorted by the countries average life expectancy.,"['Costa Rica', 2.0646100856092655]"
"which of all the fruits commonly grown in Italy, France and Spain have less than 15 grams of carbs?","['apples', 'olives', 'oranges', 'lemons', 'apricots', 'peaches', 'cherries', 'plums', 'strawberries', 'kiwifruits', 'Apple', 'orange', 'tangerine', 'watermelon', 'lemon', 'peach', 'strawberry', 'apricot', 'apple']"
Order the US Open winners of the past 10 years based on their age.,"[""Emma Raducanu (Women's singles)"", ""Bianca Andreescu (Women's singles)"", ""Coco Gauff (Women's singles)"", ""Carlos Alcaraz (Men's singles)"", ""Iga Świątek (Women's singles)"", ""Naomi Osaka (Women's singles)"", ""Naomi Osaka (Women's singles)"", ""Sloane Stephens (Women's singles)"", ""Daniil Medvedev (Men's singles)"", ""Dominic Thiem (Men's singles)"", 'Marin Čilić', ""Angelique Kerber (Women's singles)"", ""Novak Djokovic (Men's singles)"", ""Novak Djokovic (Men's singles)"", ""Rafael Nadal (Men's singles)"", ""Stan Wawrinka (Men's singles)"", ""Rafael Nadal (Men's singles)"", ""Flavia Pennetta (Women's singles)"", 'Serena Williams', ""Novak Djokovic (Men's singles)""]"
"If I plan a trek along the silk road, which countries would I need to go through?","['China', 'Kazakhstan', 'Uzbekistan', 'Afghanistan', 'Turkmenistan', 'Iran', 'Iraq', 'Syria', 'Azerbaijan', 'Turkey', 'Armenia', 'Lebanon', 'Kyrgyzstan', 'Pakistan', 'India', 'Nepal', 'Bangladesh', 'Bhutan', 'Korea', 'Japan']"
What were the class and race of Critical Role's main characters aside from those that were in Vox Machina?,"['Yasha Nydoorin', 'Barbarian', 'aasimar']"
"Which NFL teams have wide receivers from Notre Dame university , university of Florida or Louisiana state university ?","['New England Patriots', 'Cincinnati Bengals', 'Indianapolis Colts', 'Los Angeles Chargers', 'New York Giants', 'Kansas City Chiefs', 'Carolina Panthers', 'Houston Texans', 'Jacksonville Jaguars', 'Dallas Cowboys', 'Washington Commanders', 'Chicago Bears', 'Minnesota Vikings', 'New Orleans Saints', 'Tampa Bay Buccaneers', 'Los Angeles Rams', 'San Francisco 49ers', 'Buffalo Bills', 'Miami Dolphins', 'Pittsburgh Steelers']"
"Listed by date of Theatrical release, chronologically, what are Neil Simon's plays which have also been made into movies","['Come Blow Your Horn (1961)', 'Barefoot in the Park (1963)', 'The Odd Couple (1965)', 'Sweet Charity (1966)', 'The Star-Spangled Girl (1966)', 'Plaza Suite (1968)', 'Last of the Red Hot Lovers (1969)', 'The Gingerbread Lady (1970)', 'The Sunshine Boys (1972)', 'The Prisoner of Second Avenue (1971)', 'California Suite (1976)', 'Chapter Two (1977)', 'I Ought to Be in Pictures (1980)', 'Brighton Beach Memoirs (1983)', 'Biloxi Blues (1985)', 'Broadway Bound (1986)', 'Lost in Yonkers (1991)', ""Jake's Women (1992)"", 'Laughter on the 23rd Floor (1993)', 'London Suite (1995)']"
What other shows were written by the creators of Rick and Morty?,"['Acceptable.TV', 'Fish Hooks', 'Mystery Science Theater 3000', 'Solar Opposites', 'The Boys Presents: Diabolical', 'The Paloni Show! Halloween Special!', 'King Star King', 'House of Cosbys', 'Heat Vision and Jack', 'Computerman', 'Tenacious D: Time Fixers', 'MTV Video Music Awards 2006', 'The Sarah Silverman Program', 'Googas', 'Spike Video Game Awards 2008', 'The 81st Annual Academy Awards', 'Community', 'Great Minds with Dan Harmon', 'HarmonQuest', 'Mystery Science Theater 3000: The Return']"
"For every middle eastern country, including the Maghreb, list its tallest building as of 2023, its height in meters, and the country that it is in.","['Iconic Tower', '393.8 m', 'Egypt']"
Which founders of the largest tech companies in the world were younger than 30 when founding their company?,"['Pony Ma', 'Charles Chen', 'Steve Jobs', 'Danny Lui', 'David Packard', 'Andrew McCollum', 'Dustin Moskovitz', 'Tony Zhang', 'Larry Page', 'Terry Gou', 'Bill Gates', 'Steve Wozniak', 'Bill Hewlett', 'Eduardo Saverin', 'Akio Morita', 'Paul Allen', 'Kōnosuke Matsushita', 'Mark Zuckerberg', 'Sergey Brin', 'Chris Hughes', 'Michael Dell']"
What are some vegan dishes made in Chile?,"['Guiso de acelga', 'Merkén', 'Chapalele', 'Milcao', 'Chochoca', 'Tomates rellenos', 'Porotos granados', 'Tomaticán', 'Pan de Pascua', 'Ensalada de quinoa', 'Timbal de quinoa', 'Sopaipilla', 'Ensalada Chilena', 'Zapallitos rellenos', 'Tortilla de porotos verdes', 'Garbanzos con arroz', 'Porotos Granados con mazamorra', 'Porotos Granados con pilco', 'Arroz graneado', 'Fritos de coliflor', 'Panqueques']"
"During the American civil war, how many Union military leaders were there from each state?","['Kentucky', 9]"
"Besides its incumbent president, what was the political affiliation of each president of Moldova since the country gained its independence?","['Mircea Snegur', 'Independent']"
Name the US constitution amendments that do not concern slaves or voting rights.,"['1st', '2nd', '3rd', '4th', '5th', '6th', '7th', '8th', '9th', '10th', '11th', '12th', '14th', '16th', '17th', '18th', '20th', '21st', '22nd', '23rd', '25th', '27th']"
What is the form of government in all states bordering states that border Germany?,"['Germany', 'federal, parliamentary, representative democratic republic']"
Which popular houseplants are native to South America?,"['Anthurium spp.', 'Monstera species (Swiss cheese plants)', 'Sinningia speciosa (gloxinia)', 'Tradescantia zebrina (purple wandering Jew)', 'Aphelandra squarrosa (zebra plant)', 'Araucaria heterophylla (Norfolk Island pine)', 'Bromeliaceae (bromeliads, including air plants)', 'Calathea, Goeppertia and Maranta spp. (prayer plants)', 'Orchidaceae (orchid) spp.', 'Peperomia spp.', 'Palms, such as Chamaedorea elegans (parlor palm) and Dypsis lutescens (areca palm),', 'Philodendron spp.', 'Spathiphyllum (peace lily)', 'Cactaceae (cacti)', 'Mammillaria', 'Zygocactus (Christmas cactus)', 'Gymnocalycium mihanovichii (chin cactus)', 'Echeveria spp.', 'Senecio angulatus (creeping groundsel)', 'Yucca spp.', 'Begonia species and cultivars', 'Epiphyllum (orchid cacti)']"
Which types of tanks did each Allied nation use during WWII?,"['Light Tank Mk VI', 'Light Tank Mk VII Tetrarch', 'M3 and M5 Light Tanks', 'Light Tank (Airborne), M22', 'Light Tank, M24', 'Tank, Medium, Mk.II', 'Medium Tank M3', 'Medium Tank M4', 'Sherman Firefly', 'Tank, Cruiser, Mk.I (A9)', 'Tank, Cruiser, Mk.II (A10)', 'Tank, Cruiser, Mk.III (A13)', 'Tank, Cruiser, Mk.IV (A13 Mk.II)', 'Tank, Cruiser, Mk.V, Covenanter (A13 Mk.III)', 'Tank, Cruiser, Mk.VI, Crusader (A15)', 'Tank, Cruiser, Mk.VII, Cavalier (A24)', 'Tank, Cruiser Mk.VIII, Centaur (A27L)', 'Tank, Cruiser, Mk.VIII, Cromwell (A27M)', 'Tank, Cruiser, Mk.VIII, Challenger (A30)', 'Tank, Cruiser, Comet I (A34)', 'Tank, Cruiser, Centurion I (A41)', 'Tank, Infantry, Mk.I, Matilda I', 'Tank, Infantry, Mk.II, Matilda II', 'Tank, Infantry, Mk.III Valentine', 'Tank, Infantry, Mk.IV, Churchill', 'Tank, Infantry, Valiant', 'Infantry Tank Black Prince', 'Tank, Heavy Assault, A33 (Excelsior)', 'Tortoise heavy assault tank', 'Tank, Heavy TOG 1', 'Tank, Heavy TOG 2']"
"How ethnically diverse is ESPN as a workplace, when considering its current commentators and analysts?","['American', 29]"
Who are the deans of all Canadian law schools?,['Sarah Harding']
Which NATO member countries have changed their prime minister in the past 6 years?,"['Belgium', 'Bulgaria', 'Czech Republic', 'Denmark', 'Estonia', 'Finland', 'France', 'Germany', 'Greece', 'Iceland', 'Italy', 'Latvia', 'Lithuania', 'Montenegro', 'North Macedonia', 'Norway', 'Poland', 'Romania', 'Slovakia', 'Slovenia', 'Spain', 'United Kingdom']"
What was the median age of the MKs of each party in the 24th Knesset?,"['Likud', 61.0]"
What countries have a majority Muslim population and are located in Africa?,"['Chad', 'Somalia', 'Guinea', 'Tunisia', 'Sierra Leone', 'Libya', 'Mauritania', 'Gambia', 'Guinea-Bissau', 'Djibouti', 'Comoros', 'Sahrawi Arab Democratic Republic', 'Nigeria', 'Egypt', 'Sudan', 'Algeria', 'Morocco', 'Ivory Coast', 'Niger', 'Burkina Faso', 'Mali', 'Senegal']"
Which of the United States states had been a territory that belonged to France at some point?,"['Illinois', 'Iowa', 'Louisiana', 'Maine', 'Michigan', 'Missouri', 'Oklahoma', 'Alabama', 'Arkansas', 'Colorado', 'Indiana', 'Kansas', 'Minnesota', 'Mississippi', 'Nebraska', 'Ohio', 'South Dakota', 'Texas', 'Vermont', 'Wisconsin', 'Tennessee', 'New Mexico', 'Virginia']"
"What are the world's most venomous snakes, and where are they found?","['Inland Taipan', 'The black soil plains in the semiarid regions where the Queensland and South Australia borders converge.']"
List all African countries where a Germanic language serves as an official state language.,"['South Africa', 'Mauritius', 'South Sudan', 'Eswatini', 'Sierra Leone', 'Liberia', 'Burundi', 'Lesotho', 'Seychelles', 'Kenya', 'Tanzania', 'Uganda', 'Cameroon', 'Sudan', 'Zimbabwe', 'Namibia', 'Rwanda', 'Malawi', 'Nigeria', 'Ghana', 'Zambia', 'Botswana', 'The Gambia']"
Which script systems are in use by more than one language?,"['Latin', 'Chinese', 'Devanagari', 'Bengali–Assamese', 'Kana', 'Telugu', 'Tamil', 'Gujarati', 'Kannada', 'Burmese', 'Thai', 'Gurmukhi', 'Lao', 'Odia', 'Geʽez', 'Sinhala', 'Hebrew', 'Khmer', 'Tibetan', 'Georgian', 'Canadian Syllabics', 'Arabic', 'Cyrillic']"
Which current NBA players also played for a team that won the NCAA Division Tournament in the past eight years?,"['Jalen Brunson', 'Josh Hart', 'Donte DiVincenzo', 'Ryan Arcidiacono', 'Mikal Bridges', 'Collin Gillespie', 'Jermaine Samuels', 'Theo Pinson', 'Isaiah Hicks', 'Braxton Key', 'Ty Jerome', ""De'Andre Hunter"", 'Mamadi Diakite', 'Jay Huff', 'Adam Flagler', 'Jared Butler', 'Davion Mitchell', 'Christian Braun', 'Jalen Wilson', 'Ochai Agbaji', 'Adama Sanogo', 'Jordan Hawkins', 'Andre Jackson Jr.']"
What are Poland's main political parties?,"['Law and Justice', 'Sovereign Poland', 'Renewal of the Republic of Poland', 'Polish Affairs', ""Kukiz'15"", 'Civic Platform', 'Modern', 'Polish Initiative', 'The Greens', 'Zieloni', 'Yes! For Poland', 'AGROunion', 'New Left', 'Left Together', 'Polish Socialist Party', 'Labour Union', 'Poland 2050', ""Polish People's Party"", 'Centre for Poland', 'Union of European Democrats', 'New Hope', 'National Movement', 'Confederation of the Polish Crown']"
List all the Roman Imperial dynasties along with the number of years that each dynasty ruled,"['Flavian dynasty', 27.016438356164382]"
Which TV shows in the 2010s have had Bryan Cranston play a part other than the narrator?,"['Family Guy', 'How I Met Your Mother', 'Breaking Bad', 'Glenn Martin, DDS', 'Saturday Night Live', 'The Handlers', 'Robot Chicken', 'Archer', '30 Rock', 'The Simpsons', 'The Cleveland Show', 'Sneaky Pete', 'SuperMansion', 'All the Way', ""Philip K. Dick's Electric Dreams"", 'Curb Your Enthusiasm', 'The Dangerous Book for Boys', 'Last Week Tonight with John Oliver', 'Better Call Saul', ""It's Always Sunny in Philadelphia"", 'One Life to Live', 'The Flash', 'The X-Files', 'American Dad!']"
"What is the name, area, population, capital and the population of the capital for each EU member state? ","['Lithuania', '65,200', '2,867,725', 'Vilnius', '593,436']"
Which male players have won the same Grand Slam tournament more than two years in a row?,"['Jack Crawford', 'Novak Djokovic', 'Roy Emerson', 'Anthony Wilding', 'Björn Borg', 'Fred Perry', 'Laurence Doherty', 'Pete Sampras', 'Reginald Doherty', 'Roger Federer', 'William Renshaw', 'Arthur Ashe', 'Bill Tilden', 'Ivan Lendl', 'John McEnroe', 'Malcolm Whitman', 'Oliver Campbell', 'Richard Sears', 'William Larned', 'André Vacherot', 'Marcel Vacherot', 'Max Decugis', 'Paul Aymé', 'Rafael Nadal', 'Yvon Petra']"
Which of Mexico's wars began in what can be labeled as a civil war or rebellion?,"['Mexican War of Independence', 'Long Expedition', 'Yaqui Wars', 'Casa Mata Plan Revolution', 'Rebellion of Oaxaca', 'Rebellion of Puebla', 'Texas Revolution', 'Rebellion of the Republic of the Rio Grande', 'Caste War of Yucatán', 'Reform War', 'Mexican Revolution', 'Magonista Rebellion', 'Escobar Rebellion', 'Dirty War', 'Zapatista Uprising', 'Rebellion of Guadalajara', 'Fredonian Rebellion', 'Conservative Coup', 'Zacatecas Rebellion', 'Revolution of Ayutla', 'Cortina Troubles', 'Garza Revolution', 'Cristero War', 'Mexican Indian Wars', 'Revolt of Querétaro']"
Which Ottoman sultans were not the son of the previous sultan?,"['Murad V', 'Abdul Hamid II', 'Mehmed V', 'Mehmed VI', 'Abdulmejid II', 'Süleyman Çelebi', 'Musa Çelebi', 'Mehmed Çelebi', 'Mustafa Çelebi', 'Mustafa I', 'Osman II', 'Murad IV', 'Ibrahim', 'Suleiman II', 'Ahmed II', 'Mustafa II', 'Ahmed III', 'Mahmud I', 'Osman III', 'Mustafa III', 'Abdul Hamid I', 'Selim III', 'Mustafa IV', 'Mahmud II', 'Abdulaziz']"
Which musicians from the West Coast have won Grammy awards on 2022?,"['Brandon Anderson', 'Christopher Brody Brown', 'Nate Mendel', 'Pat Smear', 'H.E.R.', 'Baby Keem', 'Charlie Rosen', 'Mike Shinoda', 'Sangeeta Kaur', 'Olivia Rodrigo', 'Doja Cat', 'Taylor Eigsti', 'Foo Fighters', 'Rami Jaffee', 'Chris Shiflett', 'Kendrick Lamar', 'Dwayne Abernathy, Jr.', 'Tyler, the Creator', 'Esperanza Spalding', 'Los Lobos', 'Andra Day', 'Olivia Harrison', 'Deftones', 'Leslie Ann Jones', 'Bonnie Raitt']"
"Historically, how many NBA scoring leaders are there from each team?","['Denver Nuggets', 1]"
Which villains are featured in each of the Crash Bandicoot video games?,"['Crash Bandicoot', 'Doctor Neo Cortex']"
Where is each Pixar film set?,"['Toy Story', 'a world where toys come to life when humans are not present']"
"For every ninth gen gaming console tell me what is its CPU, storage size, memory, graphics card and backward compatibility?","['Xbox Series X and Series S', 'Custom AMD 8-core Zen 2', '1 TB (Series X)', 'Series X: 10 GB/320-bit & 6 GB/192-bit (16 GB total)', 'Custom AMD Radeon RDNA 2 architecture', 'All Xbox One games']"
Which Oscar winners for Best Lead Actor and Actress were themselves born outside of either the US or the UK?,"['Marion Cotillard', 'Jean Dujardin', 'Claudette Colbert', 'Natalie Portman', 'Cate Blanchett', 'Geoffrey Rush', 'Michelle Yeoh', 'Emil Jannings', 'Paul Muni', 'Paul Lukas', 'Yul Brynner', 'Maximillian Schell', 'Roberto Benigni', 'Anna Magnani', 'Russell Crowe', 'Mary Pickford', 'Norma Shearer', 'Marie Dressler', 'Luise Rainer', 'Simone Signoret', 'Joan Fontaine', 'Ingrid Bergman', 'Olivia de Havilland', 'Audrey Hepburn', 'Sophia Loren', 'Charlize Theron']"
How many parliament (lower house) members are in each member country of the EU?,"['Austria', '183']"
What is the percentage of seats held by Left-wing parties in each parliament of an EU country?,"['Denmark', 77.09497206703911]"
"Over the past 30 years, which women have served as Cabinet members in the United States, Chronologically?","['Donna Shalala', ""Hazel R. O'Leary"", 'Janet Reno', 'Madeleine Albright', 'Alexis Herman', 'Ann Veneman', 'Elaine Chao', 'Gale Norton', 'Margaret Spellings', 'Condoleezza Rice', 'Mary E. Peters', 'Hillary Clinton', 'Janet Napolitano', 'Hilda Solis', 'Kathleen Sebelius', 'Sally Jewell', 'Penny Pritzker', 'Sylvia Burwell', 'Loretta Lynch', 'Betsy DeVos', 'Kirstjen Nielsen', 'Kamala Harris', 'Janet Yellen', 'Jennifer Granholm', 'Gina Raimondo', 'Marcia Fudge', 'Deb Haaland']"
Return the major ancestry groups of Asian Americans along with the languages and major religions practiced by each group.,"['Chinese American', 'various varieties of Chinese', '52% Irreligion']"
Who are the warring sides in the second Libyan Civil War? Who are their leaders?,"['Government of National Accord', 'Fayez al-Sarraj']"
List all graphical novels written by French artists.,"['le Timbre maudit', 'les Leçons du nourrisson savant', 'les Leçons du nourrisson savant', 'le Nourrisson savant et ses parents (1990)', 'le Cheval blême', 'le Cercueil de course', 'le Livre somnambule', 'le Messie discret in le Retour de Dieu', 'le Nain jaune', 'la Bombe familiale', 'le Tengû carré', 'les 4 Savants', ""le Démon à tête d'entrailles (1996)"", 'la Circonvolution de la peur (1997)', 'le Paradis terrestre (1998)', ""L'Association en Égypte"", 'Maman a des problèmes', 'Hiram Lowatt et Placido', 'la Révolte de Hop-Frog', 'les Ogres', 'la Ville des mauvais rêves', 'Urani', 'le Capitaine écarlate', 'la Lecture des ruines', 'les Incidents de la nuit', 'les Traces du dieu Enn', ""l'Embuscade"", ""l'Ascension du Haut Mal"", 'les Chercheurs de trésors', ""l'Ombre de Dieu"", 'la Ville froide', 'Babel', 'les Complots nocturnes', 'Zèbre', 'le Jardin armé et autres histoires', '2 Rêves', 'Par les chemins noirs', ""Journal d'Italie 1, Trieste-Bologne"", 'Best of Enemies: A History of US and Middle East Relations']"
"Show the name, birth year and career average of points for each member of the 2019-2020 roster of the Boston Celtics.","['Brown, Jaylen', '1996', '18.6 (Regular season)']"
Name the male singles Wimbledon winners that are from Europe and won before they turned 30.,"['Richard Krajicek', 'Roger Federer', 'Spencer Gore', 'Joshua Pim', 'Stefan Edberg', 'Björn Borg', 'Wilfred Baddeley', 'William Renshaw', 'Ernest Renshaw', 'Harold Mahony', 'Laurence Doherty', 'Reginald Doherty', 'Willoughby Hamilton', 'Henri Cochet', 'Jean Borotra', 'René Lacoste', 'Andy Murray', 'Fred Perry', 'Carlos Alcaraz', 'Manuel Santana', 'Rafael Nadal', 'Goran Ivanišević', 'Jan Kodeš', 'Michael Stich', 'Novak Djokovic', 'Boris Becker', 'Frank Hadow']"
What is the current percentage of indigenous peoples in each country in America?,"['Uruguay', 2.2313543046937476]"
Which historical figures have an entire Parisian museum dedicated to them?,['Auguste Comte']
Which artists performed at the Billboard Music Awards in 2015?,"['Van Halen', 'Fall Out Boy', 'Wiz Khalifa', 'Nick Jonas', 'Meghan Trainor', 'John Legend', 'Mariah Carey', 'Wiz Khalifa', 'Charlie Puth', 'Lindsey Stirling', 'Jussie Smollett', ""Bryshere 'Yazz' Gray"", 'Estelle', 'Hozier', 'Little Big Town', 'Faith Hill', 'Pitbull', 'Chris Brown', 'Ed Sheeran', 'Britney Spears', 'Iggy Azalea', 'Nicki Minaj', 'David Guetta', 'Tori Kelly', 'Simple Minds', 'Kelly Clarkson', 'Imagine Dragons', 'Kanye West']"
Show names of Marvel movies ordered by box office performance for all films released after 2010.,"['Avengers: Endgame', 'Avengers: Infinity War', 'Spider-Man: No Way Home', 'The Avengers', 'Avengers: Age of Ultron', 'Black Panther', 'Iron Man 3', 'Captain America: Civil War', 'Spider-Man: Far From Home', 'Captain Marvel', 'Doctor Strange in the Multiverse of Madness', 'Spider-Man: Homecoming', 'Guardians of the Galaxy Vol. 2', 'Thor: Ragnarok', 'Black Panther: Wakanda Forever', 'Guardians of the Galaxy Vol. 3', 'Guardians of the Galaxy', 'Thor: Love and Thunder', 'Captain America: The Winter Soldier', 'Doctor Strange', 'Thor: The Dark World', 'Ant-Man and the Wasp', 'Ant-Man', 'Ant-Man and the Wasp: Quantumania', 'Thor', 'Shang-Chi and the Legend of the Ten Rings', 'Eternals', 'Black Widow', 'Captain America: The First Avenger']"
Name the political party leaders in Romania.,['Marcel Ciolacu']
What were the professions of the film characters portrayed by Charlize Theron throughout her career?,['animal refuge worker']
"For each team in the NBA, name its city, population and stadium.","['Washington Wizards', 'Washington D.C.', '705,749', 'Capital One Arena']"
Tell me what's the national dish of each country in Central Europe?,"['Austria', 'Wiener schnitzel']"
What political parties are there in Romania and who leads them?,"['Social Democratic Party', 'Marcel Ciolacu']"
Who were the leaders of the First Crusade and what were their titles?,"['Raymond IV of Toulouse', 'count of Toulouse']"
"Which actresses have acted with Actor Cary Grant, in starring roles During the 1940s?","['Rosalind Russell', 'Irene Dunne', 'Gail Patrick', 'Martha Scott', 'Rita Quigley', 'Libby Taylor', 'Elisabeth Risdon', 'Katharine Hepburn', 'Ruth Hussey', 'Jean Arthur', 'Ginger Rogers', 'Ferike Boros', 'Natasha Lytess', 'Laraine Day.', 'Janet Blair', 'Priscilla Lane', 'Josephine Hull', 'Jean Adair', 'Alexis Smith', 'Mary Martin', 'Jane Wyman', 'Dorothy Malone', 'Eve Arden', 'Myrna Loy', 'Shirley Temple', 'Loretta Young', 'Betsy Drake', 'Ann Sheridan', 'Ethel Barrymore', 'Joan Fontaine', 'Ingrid Bergman']"
Which US presidents did not attend neither Harvard nor Princeton or Yale?,"['George Washington', 'Thomas Jefferson', 'James Madison', 'James Monroe', 'Andrew Jackson', 'Martin Van Buren', 'William Henry Harrison', 'John Tyler', 'James K. Polk', 'Zachary Taylor', 'Millard Fillmore', 'Franklin Pierce', 'James Buchanan', 'Abraham Lincoln', 'Andrew Johnson', 'Ulysses S. Grant', 'James A. Garfield', 'Chester A. Arthur', 'Grover Cleveland', 'Benjamin Harrison', 'William McKinley', 'Warren G. Harding', 'Calvin Coolidge', 'Herbert Hoover', 'Harry S. Truman', 'Dwight D. Eisenhower', 'Lyndon B. Johnson', 'Richard Nixon', 'Jimmy Carter', 'Ronald Reagan', 'Donald Trump', 'Joe Biden']"
What does each of the major Yoruba deities represent?,"['Olodumare', 'The Source of Creation']"
How many museums are there in each city in Israel?,"['Netanya', 1]"
"Out of all the rookies who started in the 2019-2020 NBA season, which ones have so far made it to the NBA playoffs?","['Jarrett Culver', ""De'Andre Hunter"", 'Ja Morant', 'Terance Mann', 'Matisse Thybulle', 'Carsen Edwards', 'Quinndary Weatherspoon', 'Daniel Gafford', 'Brandon Clarke', 'Rui Hachimura', 'Miye Oni', 'RJ Barrett', 'Bruno Fernando', 'Jaxson Hayes', 'Coby White', 'Jordan Poole', 'Nic Claxton', 'Bol Bol', 'Jaylen Nowell', 'Tremont Waters', 'Cameron Johnson', 'Talen Horton-Tucker', 'Nassir Little', 'Jarrell Brantley', 'Eric Paschall', 'Tyler Herro', 'Grant Williams', 'Nickeil Alexander-Walker', 'KZ Okpala', 'Cam Reddish', 'Romeo Langford', 'Darius Bazley']"
What Stephen King novels had a big / small screen adaptation?,"['Carrie', ""'Salem's Lot"", 'The Shining', 'The Stand', 'The Dead Zone', 'Firestarter', 'Cujo', 'The Running Man', 'The Dark Tower: The Gunslinger', 'Christine', 'Pet Sematary', 'Cycle of the Werewolf', 'Thinner', 'It', 'Misery', 'The Tommyknockers', 'The Dark Half', 'Needful Things', ""Gerald's Game"", 'Dolores Claiborne', 'The Green Mile', 'Desperation', 'Bag of Bones', 'Dreamcatcher', 'The Colorado Kid', 'Cell', ""Lisey's Story"", 'Under the Dome', 'Doctor Sleep', 'Mr. Mercedes', 'Finders Keepers', 'End of Watch', 'The Outsider']"
"For every OECD country, what is the manner by which its Supreme Court judges are appointed?","['Australia', 'Appointed by Governor-General following nomination by Prime Minister, and advice from Attorney-General']"
Which independent countries was Elizabeth II Queen of throughout her lifetime?,"['United Kingdom', 'Canada', 'Australia', 'New Zealand', 'South Africa', 'Pakistan', 'Ceylon', 'Ghana', 'Nigeria', 'Sierra Leone', 'Tanganyika', 'Jamaica', 'Trinidad and Tobago', 'Uganda', 'Kenya', 'Malawi', 'Malta', 'The Gambia', 'Rhodesia', 'Guyana', 'Barbados', 'Mauritius', 'Fiji', 'The Bahamas', 'Grenada', 'Papua New Guinea', 'Solomon Islands', 'Tuvalu', 'Saint Lucia', 'Saint Vincent and the Grenadines', 'Belize', 'Antigua and Barbuda', 'Saint Kitts and Nevis']"
