question,answer
for how many years since 1999 has Tom Cruise been in two or more movies in the same year?,[3]
Is the National Dish of Algeria Keto diet friendly?,[False]
Did Timbaland produce any record albums for non-R&B artists?,[True]
Who was the second oldest player to lead the NBA in scoring?,['Stephen Curry']
"Considering the actors that portrayed the MCU Avengers in Endgame, was any of them ever married to someone outside of the film industry?",[True]
For how many years have Presidents of Italy ever been affiliated with a left leaning party?,[28.963]
Which right-wing party won the most votes in Uruguay's most recent election?,['National Party']
Have there been more female Futurist painters than Precisionist ones?,[True]
Has Klaus Kinski been in more movies directed by Werner Herzog than John Wayne was in John Ford films?,[False]
How many of the first ten winners of The Voice were female?,[4]
What was the most recent movie in the Western genre to win the Academy Award for Best Picture?,['No Country for Old Men']
How many academy award winners for best female actress were born in a non-English speaking country?,[11]
Who was the first Ottoman sultan to die in battle and who was the last?,"['Murad I', 'Musa Çelebi']"
which dynasty ruled the longest during the late Roman Empire?,['Palaiologan dynasty']
What percentage of Shakespeare's plays have at least one scene that takes place in England?,[43.58974358974359]
How many times since 2000 have the NBA finals ended in four games?,[3]
How many World Series did Bud Selig preside over?,[21]
Does Albania have a higher GDP per capita than any of the countries that border it?,[False]
How many wars was Oman part of between 1700 and 1900 ?,[4]
how many heirs did Sam Walton have?,[4]
who was the CEO of Microsoft when the original Xbox was released?,['Steve Ballmer']
What percentage of governors in the United States are women?,[24.0]
Which winners of the Oscar for best director from 1995-2020 were born in New York city?,['Martin Scorsese']
What percentage of battles in the American Civil War were fought outside of the territory of the Confederate States?,[25.106382978723403]
Which NFL teams won at least 9 games in all regular seasons from 2018 to 2022?,['Kansas City Chiefs']
Kyler Murray or cam newton had more rushing touchdowns as a rookie?,['Cam Newton']
Which teammate of Kobe Bryant holds the highest career point average?,"['Malone, Karl']"
Does a banana have more fat than an avocado?,['No']
"Which South American country has the largest population of Polish descent, by percentage of its total population?",['Brazil']
"Has South Sudan had more than 400,000 civilians killed during military conflicts in the 21st century?",[True]
Which Latin American country had the highest body mass index (BMI)?,['Mexico']
What percentage of currently-existing monarchies are parliamentary democracies?,[67.44186046511628]
How many seasons of Game of Thrones had an episode written by George R.R. Martin?,[4]
"When talking about children of US presidents in the second half of the twentieth century, were there more politicians than businessmen?",[False]
Which Bachelor winners have actually resulted in marriages that lasted more than 2 years with the actual Bachelor who chose them on tv?,['Catherine Giudici']
What percentage of Oscar winning actors and actresses has had at least one divorce?,[60.95238095238095]
"What percentage of European Union member states were never controlled, in whole or in part, by the Roman Empire?",[29.62962962962963]
Which wars in Ethiopia during the 19th century were internal conflicts between rival dynasties?,['Zemene Mesafint']
Do any of Philip Roth's novel's feature a woman as its main character?,[True]
How many homeruns did Barry Bonds hit when he won his last regular season MVP award?,['45']
What percentage of the time was the Oscar winner for Best Actress older than the Oscar winner for Best Actor over the past thirty years?,[33.333333333333336]
"From 1990-2020, how many times has the US Senate majority flipped to the other party?",[5]
Which country is home to the most recipients of the Nobel Prize for Literature in the 21st century?,['France']
How many of Ingmar Bergman's films portray an unhappy marriage?,[26]
What percentage of Japanese Shoguns ended up committing suicide?,[7.142857142857143]
Were Hideyoshi and Date Masamune born during the same historical period in Japan?,['Yes']
Which European country's government currently has the highest proportion of women in ministerial positions?,['Albania']
What is the average weight of Super Bowl-winning defensive tackles since 2010?,[149.71589076923078]
Which racial group in Cuba has seen the greatest growth proportionally over the last five census?,['White']
Which year since 1960 saw the greatest increase in voter turnout for a US Presidential election over the previous election and who was its winner?,"['2020', 'Joe Biden']"
What is the median age of male Oscar winning directors compared to female directors at the year of first winning the award?,"[44.0, 49.0]"
"Was there ever a Swedish King or Queen Regent who have been married more than three times? If so, please list their names",['None']
Which female artist has won the most Album of the Year Grammy awards since 2005?,['Taylor Swift']
Which decade saw the introduction of the greatest number of female superheroes in both Marvel and DC comics combined?,['1980s']
What percentage of Emmy Award winning shows for Outstanding drama from 2010-2022 were won by shows about royal families?,[38.46153846153846]
What is the difference between the average life expectancy in the ten countries with the lowest GDP and the ten countries with the highest GDP?,[-13.821222222222218]
Which premier league team has the most South American born players?,['Aston Villa']
How many times since the 1980s was a former NBA #1 draft pick released or traded by the team that selected him after  his first year of playing with the team?,[3]
Is HBO's Euphoria more similar to the U.K. show Skins or the U.K. version of The Office?,['Skins']
"Which poll, held the day before the 2021 Canadian federal election, had the smallest prediction error compared to the actual election results?",['Mainstreet Research']
"What were the career averages of Michael Jordan in points, rebounds and assists in his first three seasons compared to his last three in the NBA?","[29.333333333333332, 5.733333333333333, 4.466666666666667, 23.866666666666667, 5.866666666666666, 4.166666666666667]"
"In EU countries, do right wing parties tend to have more women leaders than left wing parties?",[False]
Have more Australians won the French open singles than Americans (men and women)?,['no']
What percentage of European countries were once conquered by Turkish tribes throughout their history?,[41.17647058823529]
Which country outside of the OECD has the highest HDI?,['Singapore']
who are the top executives in charge of managing theme parks for Disney?,"[""Josh D'Amaro""]"
How many more carbohydrates do 100g of chocolate ice cream have compared to 100g of sliced peach?,[18.2]
"If Menorca and Mallorca were considered as one, how would their combined population rank against that of Sicily, Corsica, the island of Cyprus, and Crete?","[False, True, False, True]"
how many novels that are set outside of America have won a Pulitzer Prize for Fiction since 2013?,[1]
How many games does the Tekken franchise have?,[11]
Which of the current Big 13 tech firms has the youngest CEO?,['Meta']
Are more than a third of posts in Italy's cabinet headed by women?,[False]
Are any of the novels by Mikhail Bulgakov not satires of the Soviet communist state?,[True]
who gained the most territory as a consequence of the Second Balkan War?,['Greece']
What percentage of member states of the Commonwealth do not have English as an official language?,[16.071428571428573]
What percentage of men singles Flushing Meadows championships have been won by more than two points between 2000 and 2010?,[81.81818181818181]
What percentage of Films directed by Steven Spielberg had a worldwide box office performance of over $ 300 million ?,[50.0]
What was the average points per game for playoffs home games of the 2022 Boston Celtics ?,[103.0]
What was the shortest-lived German colony?,['Mahinland']
which country in East Africa has the youngest population?,['Uganda']
What was the combined cost of producing all of The Dark Knight movies?,[585000000.0]
How many Greek gods were believed to be the offspring of other gods (not titans)?,[9]
"In European countries, are current left-wing political parties more likely to be headed by women than right-wing ones?",[True]
What percentage of US presidents elected after 1899 were born in the southern states ?,[27.272727272727273]
Who was the maternal great grandfather of Henry II of England?,"['William the Conqueror', 'Malcolm III of Scotland']"
"In early 2025, which South American state's parliament has the greatest percentage of seats held by populist parties (either from the left or right)?",['Venezuela']
Was Pope Sixtus IV in office as Pope longer than the last Medici Pope?,['Yes']
Did Run D.M.C. release more studio albums than the Beastie Boys?,['no']
Which Habsburg Emperor ruled over Austria for the shortest amount of time?,['Leopold II']
Which main cast member of Seinfeld had the most movie experience prior to the show?,['Michael Richards']
Which territory did the Spanish lose control of during the Pueblo Revolt of 1680 and when was that territory reconquered?,"['Santa Fe de Nuevo México', '1692']"
What percentage of US states have never elected a woman to the US Senate?,[34.0]
How many countries have hosted the Olympics more than three times?,[4]
How many songwriters have received the Presidential Medal of Freedom in the United States?,[20]
Does soybeans have more vitamin C per 100g serving than 100g potatoes ?,[False]
"Since 2015, what has been the percentage of top 5 NBA drafted players to average more than 15 points in their rookie season?",[32.0]
How many percent higher is the average democracy index of Scandinavian countries compared to the average index in the Balkans?,[77.75875597403525]
Which country in the EU has the third largest population?,['Italy']
In how many wars fought between India and Pakistan did Pakistan have more than 7000 dead military personnel ?,[1]
How many prime ministers has Barbados had since 1973?,[7]
What is the largest soccer stadium in Israel?,['Teddy Stadium']
How many languages are an official language in three or more countries?,[12]
How many plays did Arthur Miller write between the ages of 20 and 40?,[15]
"As of 2022, which series has had more games, SaGa or Final Fantasy?",['Final Fantasy']
How many NBA coaches have won an NBA championship both as players and as a coach?,[13]
Are there more men or women living in Sudan?,['men']
Did Michael Jordan go to college at UCLA?,['No']
Was the most recent winner of Wimbledon men's singles older than the previous winner?,[False]
Which grain has the third highest protein content per cup of serving ?,['mung beans']
how many wars has Britain lost in the last 300 years?,[22]
how many descendants of Catherine the Great ruled Russia before the First Russian Revolution?,[6]
How many countries have had more than ten different Grand Slam singles champions?,[5]
What is the win percentage change of the Buffalo bills in 2020 NFL season compared to the 2019 NFL season ?,[0.18799999999999994]
What percentage of 2020 US budget was allocated for defense?,[11.0123778998779]
Which Latin American country has had the highest increase in life expectancy since 2000?,['Haiti']
How many NBA players since the year 2000 also played for coach K in Duke?,[55]
"Which TV show, currently on Amazon Prime, contains the largest number of Latinx actresses (named and credited)?",['El juego de las llaves']
"Which country has had more deaths from COVID, France or Portugal?",['France']
How many years ago did serena Williams last win the Australian open ?,[7.0]
What is the average age of the current WNBA general managers?,[53.0]
How many of the thirty US cities with highest murder rates are headed by Republicans?,[2]
Which African country has the highest percentage of Jewish people?,['South Africa']
When was the last time an American tennis player had won the French Open singles tournament for men?,[1999.0]
"before WWII, how many wars had Japan lost in their history?",[11]
When did the LA Sparks last win a championship?,[2016.0]
"What NFL team was founded first, the Patriots or the Cardinals?",['Cardinals']
"Which battle, fought in by Hungarian Forces during the 19th century, saw the largest loss of life of Hungarians involved in any one battle?",['Battle of Raab']
Did Chekhov write more plays before or after he turned forty?,['before forty']
Which percentage of Diane Keaton's movies feature her in a role where someone calls her mother?,[39.285714285714285]
What was the total budget for the first 3 Jurassic Park films?,[229000000.0]
What is the average height of the Dallas Mavericks NBA team players ?,[1.998]
Did the White Album premiere before Sargent Pepper?,[False]
"Which disease has resulted in more deaths, HIV or the black death?",['the black death']
"Where have more philosophical writers come from, China or England?",['England']
Are there more speakers of English or Chinese in the world?,['English']
Are there more Michelin Star restaurants in New York or in California?,['California']
What was the longest number of years between the release of two consecutive Led Zeppelin studio albums?,[3.0]
How many head coaches have won NBA finals with more than three teams?,[0]
Players from how many different countries competed in the French open woman's singles championship in 2021 ?,[20]
"Which language has fewer speakers worldwide, Spanish or French?",['French']
Which of Mexico's major wars have been with both the United States and Panama?,['None']
"Who had more Super Bowl wins, Los Angeles Rams or San Francisco 49ers?",['San Francisco 49ers']
What is the average age of all the cast in the original Broadway opening of Rent?,[52.25]
"Which country has a smaller percentage of its citizens vaccinated against COVID with at least one dose, Nigeria or Ethiopia?",['Ethiopia']
"how many Ivy League schools are located in cities with a population of 500,000 or more?",[2]
"Since 2000, how many Academy Award Best Films have been based on a novel?",[4]
For how many years in the decade from 2012 to 2021 did an MCU film top the box office?,[6]
In which year did Kendrick Lamar have the most BET Hip Hop award nominations?,['2013']
how many grams of apples would an adult male have to eat to get the recommended daily amount of protein if he only ate apples?,[21538.46153846154]
"How many operational nuclear power plants do the USA, Russia, China, and France have together compared to the rest of the world combined?","[134, 40.0]"
how many left leaning Prime Ministers has Canada had in the 21st century?,[3]
Who was the third oldest person ever appointed Italian prime minister?,['Paolo Boselli']
What percentage of seats in the parliament of El Salvador does the ruling party currently hold?,[66.66666666666667]
"Given the population growth rate of Venezuela remains the same, what is their expected population in 30 years?",[52491407.2]
what percentage of US supreme court justices throughout history did not attend an ivy league school for their postgraduate degree?,[70.08547008547009]
"Historically, name the percentage of US supreme court judges that attended an Ivy League school for their bachelor degree (BA)?",[35.8974358974359]
How many Tom Cruise films up until 2022 have grossed over 100 million dollars?,[34]
Did the Finnish army ever surpass half a million soldiers in wartime strength during the 20th century?,[True]
Is the largest NFL stadium (by capacity) larger than the largest MLB stadium?,[True]
What was the total federal budget surplus from 1996-2000 when Clinton was in office?,[302200000000.0]
Has Led Zeppelin released more than five albums?,[True]
Which Eastern Baltic languages have more than 2 million speakers?,['Lithuanian']
"In the 18th century, which Japanese Shogun had the longest rule?",['Tokugawa Ienari']
Name the country that was the most frequent ally of the UK in military conflicts,['France']
What was the age difference of the actors that played Rodrigo Borgia on Showtime's The Borgias and Tom Fontana's Borgia: Faith and Fear when each of them was playing the same character?,[-3.0]
Are there more than 15 species of wild monkeys inhabiting the indian sub-continent?,[True]
Is Cuba's life expectancy greater than it's nearest neighboring Island countries on average?,[True]
does an onion have more water than cabbage?,['cabbage']
Have any US tennis players won Wimbledon in the past five years?,[True]
How many titles are there in Mongol nobility of the Northern Yuan?,[5]
Which US president had the highest budget deficit over the past 15 years?,['Joe Biden']
Which Ivy League school is located in the state where Bam Bam Bigelow was born?,['Princeton University']
Does Golden state coach Steve Kerr have more playoffs wins than San Antionio spurs coach Gregg Popovich ?,[False]
Has COVID resulted in more deaths than the Spanish flu?,[False]
"Who has won more grand slam tournaments, Roger Federer or Rafael Nadal?",['Rafael Nadal']
Who won more titles between the Williams sisters?,['Serena Williams']
"How many years, since its independence, has Israel been governed by non-Left wing coalition governments?",[41.824999999999996]
How many dishes belong to the cuisine of more than one Scandinavian country?,[4]
"How many female members of Knesset are in Center, Right-wing and Left-wing parties? List the number of MKs for each political affiliation.","[12, 15, 4]"
How many leaders did the Israeli Labour party have over the past 7 years?,[4]
How many siblings did Richard I of England have?,[8]
What NFL quarterback is the second oldest in the league?,['Aaron Rodgers']
In how many states did the SPD have a greater than 6 percent vote share over the second-leading party in the most recent German federal election?,[8]
"How many of Mexico's wars were fought with more than 100,000 soldiers but fewer than 500,000?",[4]
what percent of Coachella headliners in the past 5 years have been non-US citizens?,[45.45454545454545]
"The group that settled the current largest city in New Zealand, originated from where?",['Polynesia']
How many countries have formed on the back of a civil war or a coup d’etat?,[94]
How many TV shows starred both Kristen Bell and her husband?,[4]
Of NBA all time scoring leaders what is the percentage of forwards?,[50.0]
How old was the youngest US vice-president when he assumed office?,[36.153424657534245]
Was Tywin Lannister responsible for the deaths of any of Jon Snow's family members?,[True]
How many years older was the oldest prime minister of Finland than its youngest?,[39.934246575342456]
How many presidential candidates have been re-elected in Romania since the fall of Communism?,[3]
how many points per game did Kobe Bryant average during the season in which he shot his highest ever field goal percentage?,['25.2']
What is the average age of US vice-presidents when they assume office?,[54.375]
which midwestern US state has the most representatives in the US House?,['Illinois']
For how many years has Sweden been governed by the Social Democrats over the past 40 years?,[30]
Who was the oldest founder of IBM?,['Charles Ranlett Flint']
How many HBO series and miniseries has Nina Gold been casting director for?,[6]
what is the largest minority ethnic group in South Korean society and how many people are in it?,"['Chinese', '849,804']"
How many more French desserts and pastries are there than German desserts?,[15]
"In the qualified teams of 2021–22 UEFA Champions League, what is the percentage of team players that were born in the same country as their team?",[28.90378548895899]
Are there more wild elephants in Africa than in Asia?,[True]
Which City currently has more Michelin rated eateries New York or Paris?,['Paris']
in the battle that concluded the Swabian War what was the strength of the victorious side?,"['6,000']"
Which European union country has had the highest average voter turnout in its past five legislative elections?,['Malta']
what percentage of Lebron's teams that reached the NBA Finals also held the number 1 seed in their conference?,[30.0]
The life expectancy in Trinidad and Tobago is how many years lower compared to the US ?,[-5.530000000000001]
How many of Peru's wars were fought against one of their neighboring countries?,[15]
What was the highest rated original HBO drama in 2013 according to Metacritic?,['Game of Thrones']
"What university has been around longer, Harvard, Princeton, Yale or Duke?",['Harvard']
Do the official languages of Ethipoia originate from different liguistic families?,[True]
what was the familial bond between Elizabeth I of England and her successor?,['Cousins']
Which of her husband's children were allegedly killed because of Roxelana?,['Şehzade Mustafa']
What has been the growth rate of the Asian American community since 2000?,[101.81767778772628]
Who was the paternal great grandfather of Henry II of England?,['Count Fulk IV of Anjou']
How many years have passed since the current president of El Salvador has assumed office?,[3.589041095890411]
Prior to its independence what was the last ethnically Arab dynasty that had ruled over Egypt?,['Abbasid Caliphate']
Which cities have been home to at least three different NBA teams?,"['New Orleans, Louisiana']"
"Since the 2000s, which NFL team has had the most Heisman Trophy winners as its players?",['Baltimore Ravens']
"At his current career average of points per game, assuming he plays every game of each season, how many seasons would it take until Stephen Curry is in the top ten all time in scoring?",[1.839594807238395]
what was the capital city of the Western Roman Empire when it collapsed and what modern day region was it located in?,"['Salona/Spalatum', 'Dalmatia']"
Which President of Brazil presided over the largest loss of its troops in a war?,['Pedro II']
How many political parties participated in the most recent election in Sierra Leone?,[13]
Which of the seven largest European Union countries has had the highest proportion of members of parliament from left-wing parties over the past ten years?,['Sweden']
"How many Inside the NBA hosts and analysts, past and present, are former NBA champions?",[10]
Is the population of Germany greater than that of each of its neighbors?,[True]
What percentage of Coachella headliners have been rock bands?,[48.0]
How many films about wars that occurred after 1950 have won the Best Picture Academy Award?,[3]
Which US President won the elections by the smallest margin of electoral college votes between 1980 and 2020?,['George W. Bush']
"In the 2022 general election in Costa Rica, which of its liberal parties received the most votes?",['National Liberation Party']
How many members of the Chicago Bulls roster were actually born in Illinois?,[2]
Has Shakespeare written more plays than Sophocles?,[True]
Are Spanish prime ministers more likely to have been born in Madrid over the past 20 years?,[True]
What's the percentage of Academy Award winning directors who went to Tisch?,[11.267605633802816]
"Who had more husbands, Goldie Hawn or Liz Taylor?",['Liz Taylor']
What's the average age of the main cast of Euphoria?,[29.46153846153846]
"Which country party has the highest percentage of parliament seats held by separatist parties, out of Spain, Belgium and Italy?",['Belgium']
What is the total number of point guards on the Boston Celtics '23 roster?,[4]
Tell me how many wars took place in Austria during the middle ages and in how many of those wars was Austria victorious?,"[44, 26]"
"What is the percentage of foreign born individuals out of the notable musician alumni of Stanford, Harvard and Yale combined?",[15.652173913043478]
"Was the Battle of Chaldiran, in the early 1500s, the only conflict Iran waged against the Ottomans during that century?",[False]
"What is the age difference between New Zealand's incumbent prime minister, and her predecessor?",[18.0]
Does the largest city in Senegal have more than two million residents?,['No']
Are there more Alawites or Kurds in Syria?,['Alawites']
What is total population living in Balkan states?,[59924705.0]
"Out of the previous five prime ministers of Malta, how many belonged to left-wing parties?",[3]
"In EU countries, is the Green Party more likely to be headed by woman?",[True]
"Has Poland lost any kings to war in the past 600 years and if so, how old were they when they died?","[True, '20']"
In what year did the greatest number of British colonies gain their independence?,['1783']
"Given the current population trends in Japan stay the same, what is their expected population in 17 years?",[115944219.3]
how many rebounds did Moses Malone average the year he won the MVP with the Sixers?,['15.3']
"Using the most recent available figures, does Apple or Microsoft have a higher revenue per employee?",['Apple']
Which US state is the birthplace of the greatest number of NBA players who have led the league in scoring?,['New York']
How many movies has Dakota Fanning appeared in with her sister?,[2]
"Who scored the most points in his career, Shaquille O'Neal, Wilt Chamberlain or Bill Russell?",['Wilt Chamberlain']
"Who was oldest when they first won any WWF/WWE title, Randy Orton, Mick Foley, or AJ Styles?",['AJ Styles']
At what point in the past decade did Israel's parliament have the greatest number of different parties represented with at least one seat?,['2022']
How many of the 20 most recent NBA MVPs have been over two meters in height?,[12]
In how many of Ibsen's plays are the main protagonists a married couple?,[13]
Are there any upcoming shows starring the cast of You're the Worst?,[True]
