question,answer
How many emperors has Japan had since the 19th century ?,[8]
"Among the Big Five of American tech firms, which was officially founded first?",['Microsoft']
Which current NFL head coach out of Bill Belichick and Andy Reid have more NFL career wins ?,['Bill Belichick']
What percentage of queens consort of England have been foreign-born over the past 300 years?,[62.5]
Which senator has won the largest majority for a Minnesota seat since 2002?,['Amy Klobuchar']
How many men served as Ottoman Grand Vizier after Midhat Pasha and until the post was abolished?,[31]
"Who was younger when he was drafted, Dan Marino or Drew Brees?",['Dan Marino']
What is the share of African-American journalists among CNN's news anchors?,[12.5]
Are any of the major Kang variants in Marvel comics actually good guys?,[True]
"Among current NBA head coaches, how many have been coaching for over two decades?",[3]
Does Britain use more solar power or wind energy?,['wind energy']
Which NBA team has the third most NBA championship titles ?,['Golden State Warriors']
"Ever since 2010, how many times did Oscar winning films for Best Adapted Screenplay actually do better in the box office than that year's winner for Best Original Screenplay?",[5]
In how many Oscar Award-winning films did Daniel Day Lewis star while not winning an Oscar himself?,[5]
What artist or group has performed the most times at Coachella?,['Gabe Real']
How many wars did the Ottoman empire fight and win between 1450 and 1550 ?,[23]
Which country was involved in the highest number of wars that took place in Europe in the 18th Century?,['Great Britain']
How many parties in the recent federal elections had less than a 2.5 point difference between their popular vote share and share of seats in the Bundestag?,[46]
How many films has Pixar released since 2015?,[13]
by how much did the Chinese forces outnumber the Japanese in the invasion of Manchuria?,[130000.0]
How many Pixar films were directed by John Lasseter?,[5]
"How many of Charles Dickens' main characters were of working class, in his novel featuring 3 spirits at Christmas Time?",[1]
How many years have passed by between the last two US open titles of Rafael Nadal ?,[2.0]
"Which countries neighbor Moldova, besides Romania?",['Ukraine']
How long after Manchester United FC was established did they win their first Premier League title?,[114.0]
Which belligerent had the most soldiers during the Battle of Stirling Bridge?,['Kingdom of England']
How many plays by Anton Chekhov are shorter than three acts?,[10]
How many species of apes live in the African continent?,[5]
"Which country has the most LGBTQ cabinet members out of the UK, US, Canada, Australia and New Zealand?",['UK']
What is the average age difference between Manchester United and Manchester City players?,[-1.537878787878789]
Which of the four major US sports had the most work stoppages during the 1990s?,['basketball']
"Who was the most prolific novelist between Tom Robbins, Joseph Heller and Kurt Vonnegut?",['Kurt Vonnegut']
how many presidential elections has Bulgaria had in the last 10 years?,[2]
How many casualties did the French suffer in all of Napoleon's defeats combined?,[166008.0]
What is the average number of Olympic medals won by Australia per Olympic games?,[11.407407407407407]
How many episodes of Anthony Bourdain's Parts Unknown were shot in South America?,[10]
what percentage of Slavic language speakers live in Russia?,[44.00947238095238]
"Which fruit has the highest vitamin C percentage; oranges, grapefruits, kiwis and strawberries?",['kiwis']
Which of the world's largest tech companies have fewer than 5000 employees?,['None']
Are all the novels by Herman Hesse considered to be philosophical novels?,[False]
which team has Lebron played the most playoff games for?,['Cleveland Cavaliers']
Did all of the Republican political leaders in the Spanish Civil War belong to Socialist parties?,[False]
How many women have been nominated for the academy award for best supporting actress more than twice?,[30]
How many directors have worked on more than one Pixar movie?,[8]
In what years did Mary Lou Retton compete at the Olympics?,['1984']
How many of Billy Joel's albums are named after locations in New York state?,[5]
Is Croatian a part of the same language family of any other language of a Balkan country?,[True]
"Of the incumbent British ministers, what is the percentage of those who went to either Oxford or Cambridge?",[56.666666666666664]
"Out of the spoken languages in Malta, which one is the most widely spoken?",['Maltese']
what was the deadliest war in the first half of the 18th century?,['War of the Austrian Succession']
How many Spanish teams won the Euroleague?,[3]
Who was the last British monarch whose parents never ruled over England themselves?,['Victoria']
What has been the average height of Wimbledon female winners in the past decade?,[1.7575]
Does China now have more total solar power capacity than the US and the EU combined?,[True]
What percentage of EGOT winners belong to an ethnic minority?,[66.66666666666667]
How many comedy films did Tom Cruise appear in?,[10]
Name the percentage of African countries with English as an official language.,[42.592592592592595]
Which state following NY houses the most US banks with over 170 billion dollars in assets?,['North Carolina']
Did Gwyneth Paltrow ever appear in a film with her mother?,[True]
Do Marvel comics have more female superheroes than DC?,[True]
Which record label scored the most Billboard #1 hits in the 1980s?,['Columbia']
Were any of the founders of Atari alive as of October 2022?,[True]
What was the most common academic field of the past ten Irish prime ministers when obtaining their first university degree?,['political history']
Would eating three bananas satisfy the US recommended Daily Value for potassium?,[False]
in how many states in Australia does the Australian Labor Party have a majority?,[5]
How many Academy Awards for best actress were won by Katharine Hepburn and Meryl Streep combined?,[6]
Did Meryl Streep star in more romantic comedies than either Julia Roberts or Sandra Bullock?,[False]
"Are there more calories in 300 grams of pigs in blankets, fried chicken or turkey bacon?",['pigs in blankets']
What is the percentage of South American countries with an above average life expectancy compared to the rest of continent?,[43.75]
Which city in Cuba has the seventh largest population?,['Las Tunas']
what types of show were the most watched US TV show from 2000 to 2020?,['American football telecasts']
Which came first: the appointment of the first black US Supreme Court Justice or the first black member of the President's cabinet?,"[""first black member of the President's cabinet""]"
what percentage of southeast Asian countries have a monarchy?,[36.36363636363637]
What was the youngest team in the NBA in 2021?,['Oklahoma City Thunder']
how many movies has Heath Ledger been in that made more than 90 million at the box office?,[5]
What has been the average age of all Super Bowl halftime show performers since 2010?,[36.916666666666664]
Do cupcakes generally have less calories than muffins?,['yes']
"Which actresses have acted with Actor Cary Grant, in starring roles During the 1970s?",['None']
What percentage of top thirty all time MLB saves leaders were born outside the US?,[23.333333333333332]
How many Pulitzer Prize-winning plays have been adapted into movies since 1960?,[27]
"Did the director of ""School Daze"" himself attend an historically-black college or university?",['yes']
How many Empresses ruled over China from the Song dynasty?,[5]
"During the late Middle Ages, what was the percentage of English monarchs that married with foreign royals?",[70.0]
"Which former pro-wrestler has appeared in more comedy films: John Cena or Dwayne ""The Rock"" Johnson?",['John Cena']
What city's recording artists released the most Billboard #1 songs in the 1990s?,"['Huntington, New York']"
"How many government posts has the current president of Liberia held, name them, and list how long he held each of those posts?","['Senator from Montserrado County', 3.0246575342465754]"
"Of Ivan Turgenev and Guy de Maupassant, who published more works of short fiction?",['Guy de Maupassant']
did Leonard Cohen write Famous Blue Raincoat before he became a monk?,[True]
What artists over forty had hits in the Billboard top 10 last year?,['Elton John']
How many Scotland born prime ministers did the United Kingdom have ?,[7]
How many head coaches did the Buffalo Bills have since 1990?,[10]
which two European countries saw the highest and lowest voter turnout in the most recent European Parliament election?,"['Luxembourg', 'Slovakia']"
Which NFL quarterback out of Ben Roethlisberger and Troy Aikman have more super bowl wins ?,['Troy Aikman']
"List the total percentage of women among the 20 most popular Wikipedia pages of musicians, actors, politicians and athletes.",[31.25]
How many political parties are there in Nigeria's parliament?,[8]
How many more albums did Taylor Swift release in the later half of 2010's vs the earlier half of 2010's?,[-2]
"Of the nations which border Luxembourg, how many share the same system of government?",[3]
How many wars were waged in Lithuania during the middle ages?,[13]
Which of the Kingdoms in Romance of the Three Kingdoms survived the longest?,['Eastern Wu']
how many shows have won back to back Primetime Emmy Awards for Outstanding Comedy Series since the 90s?,[6]
what percentage of Nobel prizes in economics have been awarded to South Americans?,['0%']
Did any of the Naruto main villains made it alive to the end of the show?,[True]
Who has been the most frequent enemy of Vietnam during the Nguy?n Dynasty?,['Rattanakosin Siam']
"During the last twenty years, what percentage of the time has the President of the United States not belonged to the same party as the majority in the House of Representatives?",[45.0]
How old was Kurt Cobain when Nirvana's second major label album was released?,['24']
How many players on the roster of PSG FC were actually born in France?,[9]
What region of Iceland has the most people in it?,['Capital Region']
How many of the world's 20 highest-capacity nuclear power plants are located in France?,[3]
Did George R.R. Martin or J.R.R. Tolkien write more books?,['George R.R. Martin']
which US president in the 21st century allocated the largest percentage of the federal budget to education?,['Barack Obama']
"Did any NFL teams change their mascot since 2016? If so, why was it changed?","[True, ""Part of the team's rebrand in 2022""]"
How many wars were fought on Uruguayan soil in the 1800's?,[5]
what percentage of Grammy Awards for Best Rap Album were won by women?,[5.882352941176471]
How many movies directed by Dario Argento starred his daughter?,[8]
How much longer or shorter has the CEO of Apple been in their position compared to the CEO of Amazon?,[9.871232876712329]
What percentage of Union generals in the American Civil War were either killed or mortally wounded during the war?,[9.836065573770492]
Was the army of the Papua New Guinea victorious in the coconut war against the Nagriamel rebels ?,['Yes']
How many movies did Woody Allen direct before he turned 37?,[3]
"Who has more career rushing yards, Curtis Martin or Clinton Portis?",['Curtis Martin']
What percentage of films that won the Oscar for Best Director also won Best Picture?,[68.75]
Which country has provided the most foreign-born players to the current Bundesliga teams?,['France']
What percentage of Rob Zombie directed films are starring his wife?,[90.9090909090909]
how many foreign-born directors have won an Oscar in the past 20 years?,[9]
Did Beyonce's first two albums with Destiny's Child sell more total copies than her first two solo albums?,[False]
What was the highest number of films that Sidney Poitier acted in one year?,[4]
Which WNBA player has a higher point record average Diana Taurasi or Tina Charles?,['Diana Taurasi']
"What percentage of actors who have played Doctor Who, were over 40 years old when beginning the role?",[42.857142857142854]
"Which are there more of, Germanic, Slavic or Latin languages?",['Germanic']
How many total games have the Atlanta Braves won combined in their last two World Series appearances?,[4.0]
Were any of the shows out of HBO's current original series created by women screenwriters?,[True]
Has Federer won more grand slam tournaments than Tiger Woods has won PGA tours?,[False]
"Are there more than 5,000 employees working for ASUS?",[True]
What percentage of the Japanese population lives in the two largest cities in Japan?,[14.213916361511696]
has Brazil ever been at war with every one of its neighbors?,[False]
Who were Poland's main enemies in the 18th century?,['Russian Empire']
"Which English dynasty had the youngest monarchs, on average, at the time of their accession to the throne?",['House of Plantagenet (AD 1216–1399)']
What percentage of National Book Award Fiction winners since the 1970s have been African Americans?,[11.627906976744185]
How many current NFL coaches were born outside the United States?,[1]
Did Poland or Vietnam experience more COVID cases in 2021?,['Vietnam']
Which US state has had the lowest average turnout in presidential elections in the 21st century?,['Texas']
Who was the youngest person to be elected as the Lithuanian president ?,['Aleksandras Stulginskis']
how many buildings in China are taller than the tallest building in America?,[2]
How many of the last ten US Presidents were born in a New England state?,[2]
What is the average age of the Mexican Supreme Court members?,[64.2]
"Who wrote more detective novels, Agatha Christie or Arthur Conan Doyle?",['Agatha Christie']
"Since 2010, what share of Grammy Album of the Year winners were born to a parent who is also a musician?",[30.76923076923077]
Which US president has had the largest deficit in the past decade?,['Donald Trump']
"Which has fewer calories per cup when prepared, Quinoa, or Brown rice?",['Brown rice']
which French monarch had the shortest reign during the Hundred Years' War?,['John II the Good']
How many UK treasury ministers were there in the years 2009 to 2016?,[6]
Which female protagonist is the oldest in any of Jane Austen's novels?,['Lady Susan Vernon']
Which Emmy awards were won by both Maude and All in The Family?,['Outstanding Lead Actress in a Comedy Series']
How many Oscar winning actors and actresses were married to other Oscar winners?,[34]
How many years had passed since the publication of Thomas Hardy's first novel and his last?,[24.0]
Is Sashimi considered Paleo diet friendly?,[True]
Which French president since the establishment of the Fifth Republic has had the largest margin of victory in an election?,['Charles de Gaulle']
What percentage of Muslim-majority countries do not have a Sunni majority?,[11.764705882352942]
How many of the world's twenty largest yachts are owned by Arab royals?,[10]
how many different women have won a Hugo award?,[18]
How many Generals (1 star or higher) died in combat on either side of America's Civil War?,"[89, 89]"
How many R&B singers have won American Idol compared to Country singers?,"[5, 7]"
during the Battle of Mukden how old was the chief commander of the Japanese forces?,['62']
what is the fewest PPG any number 1 overall NBA draft pick has averaged in his rookie season over the past decade?,['Markelle Fultz']
Do all parties in Romania's coalition government have at least one woman ministers?,[True]
which English monarch had to wait the longest before ascending to the throne in the 17th century?,['James II']
"Which group in the US is more supportive of gay marriage: Postgrads, Rhode Islanders or people aged eighteen to twenty-nine?",['Rhode Islanders']
Do people in Midwestern US states support same sex marriage more than those in the deep south?,[True]
How many American actors who had won an Oscar over the past ten years are married to people born outside of the US?,[1]
"Is the combined total natural gas consumption of Germany, united kingdom and Italy in cubic meters per year higher than the natural gas consumption of China ?",['No']
What percentage of Swedish queen consorts came from Slavic-language speaking countries?,[7.462686567164179]
What's the percentage of Canadian prime ministers that had never served as cabinet ministers before entering office?,[39.130434782608695]
How many Joseph Conrad finished novels are set in Southeast Asia?,[6]
Do the protagonists in Quentin Tarantino films always survive to the end of the movie?,[False]
"What is the average height (in meters) of Australian opens singles titles, for men and women respectively, in the past 7 years?","[1.865, 1.7725]"
how many years passed between the collapse of the Western Roman Empire and the fall of the Eastern Roman Empire?,[977.6465753424658]
How many players on Chelsea FC were from South America in 2021?,[4]
How many of The Boys cast had previously worked with the show's creator?,[2]
What country has the largest total net capacity of all of its nuclear power stations combined?,['United States']
What country has produced the most female women's grand slam tennis singles champions since 1990?,['U.S.']
who was the first non-European and non-American woman to win the Nobel Prize for medicine?,['Elizabeth H. Blackburn']
What was the percent growth in the 65+ population in Peru in the 2000 to 2020 time period versus the 20 years before that?,"[1.7999999999999998, 1.2000000000000002]"
Do all European cities with more than 1.5 million residents have either a metro or tram?,[True]
"Based on the past twenty years, do UK Labour lead governments spend more on education than Conservative lead ones?",[True]
What was the largest number of Dutch ships used in battle during the Dutch-Portuguese War?,[81.0]
Which city in Latin American city with over a million residents has the highest population density?,['Bogotá']
Were more of the last twenty US Presidents born in New England states or Midwestern states?,['Midwestern states']
How many Asian American actors (and actresses) have won an Oscar in either a supporting or a leading role?,[7]
How many women outside of Europe have won the Nobel prize for literature?,[7]
How many of the last fifteen Presidents of Mexico were born outside of Mexico City?,[9]
"Have left leaning parties held political power for most of Portugal's history, following its transition to democracy?",[True]
In how many of the fifteen most expensive transfers of soccer players did the player help his new team win a league title the same year?,[11]
What's the maximum number of Olympic gold medals won by an NBA player?,[4.0]
"Out of the most profitable British businesses, which sector has had greater annual profits, Banking or Insurance?",['Banking']
What has been the average number of women Nobel prize winners in each year over the past decade?,[1.6]
what is the average age of the winners of the Academy Award for best actress since 1998?,[41.25]
what is the lowest percent of the vote that Bashar al-Assad has received in any election since 2000?,[92.2]
What were Napoleon's final two defeats? When were they and by whom?,"['Waterloo (1815)', '18 Jun 1815', 'Seventh Coalition']"
Which nation has been the most frequent enemy of Britain in the 18th century?,"['France', 'Spain']"
By how many dollars did the federal deficit change from Obama's first federal budget to his last?,"[481000000000.0, 335000000000.0]"
"Out of the novels written by Haruki Murakami, which ones draw on actual historical events as part of their plots?","['Hear the Wind Sing', 'Norwegian Wood']"
How does the average Billboard 200 ranking of Taylor Swift albums compare to that of Rihanna?,[3.0]
What was the average number of Knesset seats held by Arab parties in the 1990s compared to the 2010s?,[8.0]
Who was the first Asian novelist ever to win a Hugo Award for Best Novel?,"['Ken Liu', 'Cixin Liu']"
Which two kingdoms were the last to declare war on Sweden during the Great Northern War?,"['Great Britain', 'Hanover']"
"Which Academy award winning directors are women, born outside the US?","['Chloe Zhao', 'Jane Campion']"
"looking at Latvia's biggest export partners, where do the other Baltic countries rank?","['Lithuania', '1']"
what percent of nominees for best picture Oscar were directed by women in 2021 compared to 2010?,[25.0]
"which spider-man story arcs following Origin of the Species have featured the hobgoblin, and when were they published?","['Big Time', 'November 2010–March 2011']"
Which other tech companies have their headquarters in the same city as Microsoft?,"['Nintendo of America', 'Mindtree']"
What has been the average number of children per Spanish monarch during the 1800s compared to the 2000s?,[5.285714285714286]
Name the NFL team that has won the same number of super bowl titles as the green bay packers ?,"['Kansas City Chiefs', 'New York Giants']"
Which Slavic languages are spoken by fewer than 50 million people but more than 25 million?,"['Ukrainian', 'Polish']"
"What was the percentage of Grammy record of the year winners that were men up until 1980, compared to their percentage in 1980-2000?",[79.41176470588235]
Which of the United States' fellow NAFTA members also signed onto the Trans-Pacific Partnership?,"['Canada', 'Mexico']"
what percentage of DR Congo's economy is service related compared to its neighbors?,['33.1%']
Which three states have the highest support rates of same sex marriage in the US and which three states have the lowest support?,"['Massachusetts', 'Washington', 'Maine']"
What is the main difference between the parliamentary election system in Israel to that of Germany?,['The closed-list method of party-list proportional representation']
What was the average happiness score of Scandinavian countries compared to that of South American countries in 2020?,[7.567]
What percentage of films that grossed over 100 million dollars were superhero movies in 2019 vs 2009?,[40.0]
What percentage of the NFL team raiders were rookies in 2020 compared to the percentage of rookies in the 2019 ?,[18.9873417721519]
"Which team has won more Super Bowls, New York Jets or Seattle Seahawks?","['New York Jets', 'Seattle Seahawks']"
Which cast members of Seinfeld won an Emmy award for shows other than Seinfeld?,"['Julia Louis-Dreyfus', 'Jason Alexander']"
Which nation has been the most frequent enemy of Britian throughout history?,"['France', 'Spain']"
What's the difference between the Roman Empire and the Holy Roman Empire?,['The Roman Empire was the post-Republican period of ancient Rome.']
"Did Aerys Targaryen order the deaths of any of Jon Snow's family members? If so, whom?","['Rickard Stark', 'Brandon Stark']"
"Who were the rulers of England when it was a republic, what was their title?","['Richard Cromwell', 'Lord Protector of the Commonwealth of England, Scotland and Ireland']"
What are the top two rarest big cat species found in the wild?,"['Tiger', 'Cheetah']"
What's the average age of first marriages for women in Scandinavia compared to those in the Balkans?,[33.56666666666667]
Who has been the most frequent enemy of Vietnam during the Nguyen Dynasty?,"['Rattanakosin Siam', 'France']"
What are the main differences between the election system in Germany and the US?,"['Plurality voting refers to electoral systems in which the candidate in an electoral district who poll more than any other (that is, receive a plurality) are elected. Under single-winner plurality voting, and in systems based on single-member districts, plurality voting is called single member  plurality (SMP), which is widely known as first-past-the-post. In SMP/FPTP the leading candidate, whether or not they have a majority of votes, is elected.', 'Party-list proportional representation (list-PR) is a subset of proportional representation electoral systems in which multiple candidates are elected (e.g., elections to parliament) through their position on an electoral list. They can also be used as part of mixed-member electoral systems.']"
"What were the average highest and average lowest approval ratings of all US presidents over the past fifty years, when grouped by party affiliation?","['Republican', 74.28571428571429, 32.285714285714285]"
"Which parties are projected to gain more seats in the next election in the Netherlands, based on recent polls?","['Socialist Party', 'Reformed Political Party']"
"Tell me what years was the drama show Emmy won by an actor or actress born outside of the US, UK, Canada or Australia, and also list also their name.","['Bruce Willis', '1987']"
What is the worst selling album to win a Grammy for Album of the Year since 2010?,"['Morning Phase', 'Golden Hour']"
"What's the average number of years for UK three-starred Michelin restaurants to have been in operation before being rated, compared to US Michelin restaurants?",[11.0]
What are the population growth and total fertility rates of Burkina Faso?,['2.46']
Jan Zizka was alive during the reigns of which Holy Roman Emperors?,"['Charles IV', 'Sigismund']"
Compare the Spanish flu outbreak to that of the Russian flu in terms of infections.,['500 million (estimated)']
Which Kubrick films took place in the 1960s?,"['Full Metal Jacket', 'Dr. Strangelove']"
Who was the oldest player on the 2021 Atlanta Braves World Series winning team?,"['Jeff Mathis', 'Jesse Chavez']"
Which nobel prize has the fewest number of Asian-born recipients?,"['Physiology or Medicine', 'Literature']"
Which NFL teams have won more than nine regular season games in every year since 2018?,"['Buffalo Bills', 'Kansas City Chiefs']"
Which Game of Thrones shooting locations were outside of Europe?,"['Canada', 'Morocco']"
